full_path,file_summary,key_exports,dependencies,content_hash
frontend/components/PromptEditor.tsx,"React component providing a CodeMirror-based editor for loading, editing, and saving prompt files with change tracking and error handling.","[""PromptEditor""]","[""react"", ""@codemirror/state"", ""@codemirror/view"", ""@codemirror/commands"", ""@codemirror/lang-markdown"", ""@codemirror/theme-one-dark""]",45abcd755708554ffc532e60770500090206577304c21e8ea963d76ffac01097
frontend/components/PromptMetricsBar.tsx,"React component that displays a toolbar with prompt token metrics, context usage visualization, view mode toggle, and action buttons for code/test/example/preview/diff panels.","[""PromptMetricsBar""]","[""react"", ""../api"", ""../lib/format""]",06564980552ea527a5eb6b00b5c7d32feb794bc6a197a688001530fb4e279c9b
frontend/components/PromptOrderModal.tsx,"React modal component that lets users select, reorder, and configure architecture modules for prompt generation with advanced global options.","[""PromptOrderModal""]","[""react"", ""../api"", ""../constants"", ""../types""]",508904f4c549f02fd5216a1b569a1d119812117c8870413936b491be72478dfa
frontend/components/PromptSelector.tsx,"React component that displays a searchable, filterable grid of prompt cards with support for creating, editing, syncing, and queuing prompts.","[""PromptSelector""]","[""react"", ""../api"", ""./CreatePromptModal"", ""./SyncOptionsModal""]",26a3d92bfd0a5208b7c728a388e668a2a2107326d2e53277990f40f3a65daa07
frontend/components/PromptSpace.tsx,"A React component providing a full-featured prompt editing workspace with CodeMirror editor, command execution sidebar, side-by-side code/test/example panels, markdown preview, token analysis, and model configuration.","[""PromptSpace""]","[""react"", ""@codemirror/state"", ""@codemirror/view"", ""@codemirror/commands"", ""@codemirror/autocomplete"", ""@codemirror/lang-markdown"", ""@codemirror/lang-python"", ""@codemirror/lang-javascript"", ""@codemirror/lang-java"", ""@codemirror/theme-one-dark"", ""marked""]",2b6bfddf5b582cd24e7fdc2b38dde8471eaf17fc677d0c888df3902563ebffe7
frontend/components/ReauthModal.tsx,"React modal component that handles GitHub device-flow re-authentication, including login initiation, code display, clipboard copy, and polling for authorization completion.","[""ReauthModal""]","[""react"", ""../api""]",e4a9e3e9e1326be5e56e2fd492d824d33df9b515d2e4d0317c0d2f9b54922d1f
frontend/components/RemoteSessionSelector.tsx,"React component that renders a dropdown selector for remote sessions with status indicators, debug info panel, and stale-session warnings.","[""RemoteSessionSelector""]","[""react""]",9b42f0456875847a7d7a47476a19f2540b4d68db504b63427db001ce51d595ca
frontend/components/SyncFromPromptModal.tsx,"React modal component that lets users sync architecture.json from prompt metadata tags, displaying pre-sync explanation, progress, and detailed per-module results with validation errors.","[""SyncFromPromptModal""]","[""react"", ""../api""]",c7cb753a020d122a5991233d1d153f285e3e3bdcc83bfc0b89bbc1c698aaf371
frontend/components/SyncOptionsModal.tsx,Provides a React modal component for configuring sync command options (such as agentic mode) before executing a sync operation.,"[""SyncOptionsModal""]","[""react""]",8dedc339185726a344da7054e44f373e3eae69a4b256f9748d7869a918c98c4d
frontend/components/SyncStatusBadge.tsx,React component that displays a color-coded badge indicating the synchronization status between a prompt and its generated code.,"[""SyncStatusBadge""]","[""react"", ""../api""]",3791184d239610a1c1d1d679346c708626b15daedbee6d66798a804c6ecfed87
frontend/components/Tabs.tsx,"React component that renders a horizontal tab bar for switching between command types, highlighting the currently active tab.","[""Tabs""]","[""react""]",838765f3bb9077dfaeab7f7c021a5e8140415ee5a74d6fb5c50ed1a82a33d551
frontend/components/TaskQueueControls.tsx,"React component that renders a control bar for a task queue, providing execution mode toggling, start/pause/resume actions, progress display, and clear buttons.","[""TaskQueueControls""]","[""react""]",e48416a9a55dbc97816ef56c81e083cc86208bf0a0e5c0a5517ca717b9d35beb
frontend/components/TaskQueueItem.tsx,"React component that renders a single task queue item with status badges, duration, drag-and-drop support, and action buttons for run, skip, retry, and remove.","[""TaskQueueItem""]","[""react""]",a651d053438f0553b18968f4421aae4877d421c6843146df8adbf276d87a2636
frontend/components/TaskQueuePanel.tsx,"A draggable, collapsible React panel component that displays a task queue with execution controls, drag-to-reorder support, and persistent panel positioning.","[""TaskQueuePanel""]","[""react""]",2db63f1a10010ee8bd58f765c50312da7b2de39316a6344d70c716e36c56dabf
frontend/components/TextAreaField.tsx,"Defines a reusable React textarea form field component with label, placeholder, description, and optional required indicator.","[""TextAreaField""]","[""react""]",8815b4343c4df6c5815f3f4ef23761725c42a539b6ef8abd3cd0d4ccaac473eb
frontend/components/Toast.tsx,"Provides a toast notification system with auto-dismiss, success/error/info variants, browser notification support, and a React context-based provider and hook.","[""ToastType"", ""ToastMessage"", ""ToastProvider"", ""useToast""]","[""react""]",86e96cb2c88a1e85b2c9b4b487775e052750873ba80087d765ac61b506b442ad
frontend/components/Tooltip.tsx,Defines a reusable React Tooltip component that displays hover-triggered tooltip content positioned below its children.,"[""Tooltip""]","[""react""]",52e48eb3ac7900db5d27115b9ec34ee37d84471f6ca086ad5fccb8bb2319e336
frontend/constants.ts,"Defines CLI command configurations, global options with defaults, and helper utilities for a PDD (Prompt-Driven Development) tool's frontend interface.","[""GLOBAL_DEFAULTS"", ""GLOBAL_OPTIONS"", ""COMMANDS"", ""getCommandByBackendName"", ""SUPPORTED_LANGUAGES"", ""getPromptTemplate""]","[""./types""]",1a549aec87b4ae4537f8df424bc98ff1048df5512756b61d47d58d2f9685c061
frontend/data/mockPrd.ts,"Exports a mock Product Requirements Document (PRD) string for a Prompt Driven Development IDE, used as test or demo data.","[""mockPrd""]",[],8bf6a64f32da3c70cf9aeb47e2c7e908560b53ef5722bc03406f0ef8654be671
frontend/data/mockPrompts.ts,"Defines an array of mock prompt fixtures containing sample React/TypeScript component definitions, configurations, and test cases for use in testing.","[""mockPrompts""]",[],d4b93c959e47e190a95c8a2cf1aaa78b5e74e7a480391c18c75a08415bbf177c
frontend/hooks/useArchitectureHistory.ts,"React hook providing undo/redo history management for architecture module state, including CRUD operations on modules, dependencies, and positions.","[""useArchitectureHistory""]","[""react""]",e95a989334e61112f3e3fc0ae23be0b7130e6c68d9953f9e680a8789eb09f854
frontend/hooks/useAudioNotification.ts,"React hook that manages audio notification sounds for job/task completion using the Web Audio API, with localStorage-persisted user preferences.","[""useAudioNotification"", ""UseAudioNotificationReturn""]","[""react""]",1699c71d34c4b3a42cb601835478da69c1c35856444143148427b63471f66aba
frontend/hooks/useJobs.ts,"React custom hook that manages concurrent job execution state, WebSocket streaming, polling for local/remote job status, and job lifecycle actions like submit, cancel, and cleanup.","[""useJobs"", ""JobStatus"", ""JobProgress"", ""JobInfo"", ""UseJobsOptions""]","[""react""]",6af56aeb30a34cce916fb4f0e91fd9038fa0d3a6f6704368898a31c55ad04566
frontend/hooks/useTaskQueue.ts,"Custom React hook for managing a sequential task queue with support for auto-run and manual execution modes, localStorage persistence, and lifecycle callbacks.","[""useTaskQueue"", ""TaskStatus"", ""ExecutionMode"", ""TaskQueueItem"", ""UseTaskQueueOptions""]","[""react""]",90decc5007998e42b7c26908c7212d3eb1936362f2fd47ff8470f9c8dd19bb38
frontend/index.html,"Entry-point HTML file for a ""Prompt Driven Development"" single-page application, configuring Tailwind CSS theming, custom animations, dark-mode styles, and module import maps.",[],[],83b3f9c62e650557b691323aaceef124d05aeb5e9b2006a7b7cecb5fc9729580
frontend/index.tsx,"Entry point that mounts the React application into the DOM, wrapped in StrictMode and a ToastProvider context.",[],"[""react"", ""react-dom"", ""./App"", ""./components/Toast""]",29f7a76e813c782fc068fa8a4ab32b4173f15c45df40636ccfd7c369c87938e0
frontend/lib/batchUtils.ts,"Computes connected components (batches) from an architecture dependency graph using Union-Find, grouping interdependent modules for sequential syncing.","[""Batch"", ""computeBatches"", ""getBatchForModule"", ""filterModulesByBatch""]",[],9582e5d41c188845d56bbc957f054647fee56a78869544c0a7d6ec3340bf7ee6
frontend/lib/commandBuilder.ts,"Provides centralized functions for building PDD CLI command arguments, options, and display strings used by UI components.","[""cleanOptions"", ""buildCommandArgs"", ""buildDisplayCommand"", ""buildCommandRequest""]","[""../types"", ""../api"", ""../constants""]",d461731ee1d65db39fd67e64f1a9967dbc6a843bed3e8ad80498730e3371d97b
frontend/lib/format.ts,Provides a utility function for formatting numeric costs as dollar-denominated strings with variable decimal precision.,"[""formatCost""]",[],08dd5f8b9a9cb4f8a5195251a1f9831f4872a56b32f8dd7c3ff2d69614fee9fa
frontend/lib/includeAnalyzer.ts,"Detects and analyzes include-type XML tags (include, include-many, shell, web) at the cursor position in a CodeMirror editor.","[""IncludeTagInfo"", ""findIncludeAtCursor"", ""getIncludeTagLine"", ""parseIncludeManyPaths""]","[""@codemirror/state""]",e5699fa72eb2eb1373f950524facc097b984e9578dc066bce044d40b57765f61
frontend/lib/modelResolver.ts,Defines a hardcoded catalog of LLM models with metadata and a function to select a model based on a strength slider value mapped to ELO rankings.,"[""ALL_MODELS"", ""resolveModelForStrength""]","[""../api""]",c825938bff2b3e1d8d62258e0e481857c5d63707eee21ae258c794c977108884
frontend/lib/pddAutocomplete.ts,"Provides a CodeMirror 6 autocomplete extension for PDD directives, offering filtered suggestions with styled tooltips when users type angle brackets.","[""pddAutocompleteExtension""]","[""@codemirror/autocomplete"", ""@codemirror/view""]",24027210f5a52e550961c215bbeb54af78c5153de67bcf992a2c71a5d99267a6
frontend/lib/pddDirectives.ts,"Defines PDD (Prompt-Driven Development) directive metadata, best practices, and category labels for use in autocomplete and a guidance sidebar.","[""PDDDirective"", ""PDD_DIRECTIVES"", ""BEST_PRACTICES"", ""CATEGORY_LABELS""]",[],84343eaacb567b11a9e1a4b9c8daeef8ec3ea15bc6f44d5dbce8880ce1f96f13
frontend/metadata.json,"JSON manifest file defining metadata for a Prompt Driven Development IDE application, including its name and description.",[],[],236fa979e03b3c15ba809c754b591c44510c5509484a0e69f60b47bdfabff806
frontend/package-lock.json,NPM lockfile (package-lock.json) pinning exact dependency versions for a React-based prompt-driven development IDE project.,[],[],7c6ad02d58863d57d952e5f9f7c7084ac2f2de24aa71ccdb3581cd61814a4a83
frontend/package.json,"Package configuration for a prompt-driven development IDE built with React, CodeMirror, ReactFlow, and Google GenAI, using Vite as the build tool.",[],[],56fe6f5bf76773df49b304f355ced0c42610df40192fd65d151205f79210b9ca
frontend/tests/compact-font-direct-zoom.test.tsx,Tests that ModuleNode's compact-mode label computes its font-size directly from the viewport zoom value rather than relying on a CSS custom property.,[],"[""react"", ""vitest"", ""@testing-library/react"", ""reactflow""]",1144cff680884affe63fe945afea6590d5c4266d984569f8013d847919370328
frontend/tests/compact-font-size.test.ts,Unit tests verifying that getCompactFontPx computes an inverse-zoom font size so text appears at a constant 14px on screen.,[],"[""vitest"", ""../components/DependencyViewer""]",236c70fc5074331c04bbaed9b667df82d27fcf9bc3cdff9c3a4213b442e38184
frontend/tests/group-layout.test.ts,Unit tests verifying the computeGroupLayout helper's grid sizing and child positioning logic for the DependencyViewer component.,[],"[""vitest"", ""reactflow""]",482184cd15b2d28d4493eb85487789d052b5487830b710d4f0e53da4cae8e075
frontend/tests/group-subflow-nodes.test.tsx,"Unit tests verifying that the DependencyViewer component correctly renders expanded/collapsed group nodes, child node positioning, and parent-child relationships in a ReactFlow graph.",[],"[""@testing-library/react"", ""vitest"", ""react""]",afe6ddbd0d1669e2e947e520d1dbf0c8b0427aab138a45a8b277e6fd8a4a4642
frontend/tests/module-needs-sync.test.tsx,"Unit tests for the `moduleNeedsSync` function, verifying it correctly detects when module outputs (code, test, example) are missing and require synchronization.",[],"[""vitest""]",e5d432057fc383e8f86dc95898b90762637259864fc8d4fecdf8c73535a5a122
frontend/tests/rearrange-discard.test.tsx,Tests that the ArchitectureView component correctly increments rearrangeVersion when the Discard button is clicked after a Re-arrange action.,[],"[""@testing-library/react"", ""vitest"", ""react""]",9df8e0282d7b33aa365e99e56d76516e291c2dd50d5d0189f4674619059422e4
frontend/tests/rearrange-positions.test.tsx,Tests that clicking the re-arrange button in ArchitectureView increments the rearrangeVersion prop passed to DependencyViewer.,[],"[""@testing-library/react"", ""vitest"", ""react""]",bcf2aa977889df91638f59fb70cee2b8924ae4611a52320a7b629e4b81eabea9
frontend/tests/setup.ts,Test setup file that configures jest-dom custom matchers for use in testing-library-based tests.,[],"[""@testing-library/jest-dom""]",a46d66851af2c056e805fdd574bf5ec3adb1181c43c5e41f0a1c592e338afe64
frontend/tests/sync-completed-refresh.test.tsx,"Tests that the ArchitectureView component refreshes prompt data when a sync-completed counter increments, and verifies the counter logic only increments for successful SYNC tasks.",[],"[""@testing-library/react"", ""vitest"", ""react""]",3fde1ff581bc5358d36892bf1a4d2116ee984c0b3825583d0f280639cbbf10f6
frontend/tests/vp-zoom-sync.test.tsx,Unit tests verifying that the VpZoomSync component keeps a CSS custom property (--vp-zoom) synchronized with the ReactFlow viewport zoom.,[],"[""react"", ""vitest"", ""@testing-library/react"", ""reactflow"", ""../components/DependencyViewer""]",a7ba5d078b2ca1d14950bec01c6a73503df66f57ea6202add574d409e06b4803
frontend/tests/waypoint-edge.test.ts,"Unit tests for `getLayoutedElements` and `buildEdgePath` functions exported from the DependencyViewer component, verifying waypoint-based edge routing and smooth bezier curve path generation.",[],"[""vitest""]",c0679ec2d76a16ad8d090433525183f8cb5b3018cc7a9b4d009321955da68088
frontend/tsconfig.json,"TypeScript compiler configuration file defining ES2022 target, React JSX support, bundler module resolution, and path aliases.",[],[],43d5f50b8182e186dc8b7e091cbdae4477888002dc0500b1765dc1f453378637
frontend/types.ts,"Defines TypeScript enums, interfaces, and types for PDD CLI command configuration, project architecture modules, and `.pddrc` configuration.","[""CommandType"", ""CommandOption"", ""GlobalOption"", ""GlobalDefaults"", ""CommandConfig"", ""PromptInfo"", ""DevUnit"", ""MockPrompt"", ""ArchitectureInterface"", ""ArchitectureModule"", ""ProjectArchitecture"", ""PddrcContextDefaults"", ""PddrcContext"", ""PddrcConfig""]",[],f6d60506e61cfa3c565477f0af7f4598108acee5326daa3487ca094fb4fd9972
frontend/vite.config.ts,"Vite configuration file that sets up a React dev server with API/WebSocket proxying, path aliases, environment variable injection, and Vitest testing settings.",[],"[""path"", ""vite"", ""@vitejs/plugin-react""]",c92ee737487ccaf5c4bb5083119696f6bf077ef0626a01b7aa1be92107e1b160
generate_model_catalog.py,"Generates a curated LLM model catalog CSV from LiteLLM's registry, filtering by quality (ELO scores), deduplicating variants, normalizing pricing, and enriching with provider metadata.","[""ELO_CUTOFF"", ""ELO_SCORES"", ""PRICE_OVERRIDES"", ""PROVIDERS"", ""CSV_FIELDNAMES"", ""build_rows"", ""main""]","[""argparse"", ""csv"", ""re"", ""sys"", ""collections"", ""datetime"", ""pathlib"", ""typing"", ""litellm""]",2937cc14412704887dafebd386c2578ec1e86d17562fe62eb95557ac8e6f4ac4
generate_output_paths.py,"Resolves output file paths for PDD commands by prioritizing user-specified paths, .pddrc context config, environment variables, and default naming conventions.","[""PathResolutionMode"", ""COMMAND_OUTPUT_KEYS"", ""DEFAULT_FILENAMES"", ""ENV_VAR_MAP"", ""CONTEXT_CONFIG_MAP"", ""EXAMPLES_DIR"", ""generate_output_paths""]","[""os"", ""logging"", ""typing""]",76cbf3665903fe3f0e59483508bb27c8b44c533d52849c6bbb0ec0edcedaba85
generate_test.py,"Generates unit tests from source code or example files by orchestrating LLM invocation, incomplete-output continuation, postprocessing, and sys.path preamble injection.","[""generate_test""]","[""re"", ""typing"", ""rich"", ""pdd""]",c34164ec5abded5fbc0e600f3ad007fc6175a29d0662dded3d57edbae9e3fb17
get_comment.py,"Looks up the comment syntax for a given programming language from a CSV data file, returning ""del"" as a default fallback.","[""get_comment""]","[""csv"", ""pdd""]",53e70fe3e4f7ba637f7c754d95a751e068754eb06d265b1e95636349c118a883
get_extension.py,Provides a function to look up file extensions for programming languages from a CSV data file.,"[""get_extension""]","[""pandas"", ""pdd""]",4f9ab4599944c8faf14fb060f83a0b6745d1d096b357de34b21c3b34a84480d7
get_jwt_token.py,"Implements GitHub Device Flow OAuth authentication with Firebase token exchange, JWT caching, and secure keyring-based refresh token storage for CLI applications.","[""get_jwt_token"", ""DeviceFlow"", ""FirebaseAuthenticator"", ""AuthError"", ""NetworkError"", ""TokenError"", ""UserCancelledError"", ""RateLimitError"", ""KEYRING_AVAILABLE"", ""JWT_CACHE_FILE""]","[""asyncio"", ""base64"", ""json"", ""logging"", ""os"", ""subprocess"", ""sys"", ""time"", ""webbrowser"", ""pathlib"", ""typing"", ""keyring"", ""requests""]",6fc201700ee5f6bddff34eb6d6595276191e876cf084f8491dc2d14ab7e8325f
get_language.py,Maps file extensions to programming language names by looking up entries in a CSV data file.,"[""get_language""]","[""csv"", ""pdd""]",65004add40c93365c1cbd705a6ef24d5bda6f7016c3a67749b25e61122c50ce7
get_run_command.py,Provides functions to look up programming language run commands from a CSV file based on file extension.,"[""get_run_command"", ""get_run_command_for_file""]","[""os"", ""csv"", ""pdd""]",5eec778a234abc4ace4166d71a68f6e49f1b81491962867de81f61be882a5319
get_test_command.py,"Resolves the appropriate language-specific test command for a given test file using CSV lookup, smart detection, or agentic fallback.","[""get_test_command_for_file""]","[""pathlib"", ""typing"", ""csv""]",1b8e0d7bb6d6d0f65e09b05a6f65d2ef7a254aec43a2cd56a2968f172f52531d
git_update.py,"Manages a git-based prompt update workflow that reads modified code, restores the prior committed version, updates the prompt via agentic or legacy paths, and restores the modified code.","[""git_update""]","[""os"", ""typing"", ""rich"", ""git""]",ca810925f80b85596c0f1f84b4a7c052ff19a8530d24ed6989730467df2a3f17
include_query_extractor.py,"Provides LLM-based semantic extraction of relevant content from source files, with persistent SHA-256-keyed disk caching under `.pdd/extracts/`.","[""IncludeQueryExtractor"", ""compute_cache_key"", ""EXTRACTION_STRENGTH""]","[""hashlib"", ""json"", ""os"", ""tempfile"", ""time"", ""pathlib"", ""pdd"", ""rich""]",5a9a5391f7878f3390da4553adc8729e2b2bdd93e006f8a42a05225f0d4435fd
increase_tests.py,"Generates additional unit tests to increase code coverage by invoking an LLM with existing tests, coverage reports, and source code.","[""increase_tests""]","[""typing"", ""rich""]",ebc70cf5dd42a5a2cb9b6212169270dfdc5b463b1fc31c12d3ac80c11a140879
incremental_code_generator.py,Analyzes prompt diffs and either incrementally patches existing generated code or recommends full regeneration using LLM-based diff analysis and code patching.,"[""incremental_code_generator"", ""DiffAnalysis"", ""CodePatchResult""]","[""typing"", ""pydantic"", ""rich""]",4686890dabd1d00e726d773c3efa9eec7c30873f601db3ff9261905e7dd7bde4
insert_includes.py,"Determines needed dependencies for a prompt using auto_include and an LLM, then inserts the relevant include blocks into the prompt text.","[""InsertIncludesOutput"", ""insert_includes"", ""main""]","[""os"", ""typing"", ""pathlib"", ""rich"", ""pydantic"", ""re""]",7aa8b935bc75ddb7e4571d4d8ff5cf74f48cee478a89a9e8b348fe633d0804d2
install_completion.py,"Provides shell detection, completion script installation, and path resolution utilities for the PDD CLI tool.","[""get_local_pdd_path"", ""get_shell_rc_path"", ""get_current_shell"", ""get_completion_script_extension"", ""install_completion""]","[""os"", ""sys"", ""importlib"", ""typing"", ""click"", ""rich""]",6cb309b8c3810efb049c3014a6088f7ac3511a163f22f06fcfc66f99b4f33f8a
llm_invoke.py,"Provides LLM invocation with automatic model selection, API key management, structured output parsing, caching, cloud/local fallback, and reasoning/thinking support via LiteLLM.","[""llm_invoke"", ""SchemaValidationError"", ""CloudFallbackError"", ""CloudInvocationError"", ""InsufficientCreditsError"", ""setup_file_logging"", ""set_verbose_logging"", ""set_quiet_logging"", ""PROJECT_ROOT"", ""ENV_PATH"", ""LLM_MODEL_CSV_PATH"", ""DEFAULT_BASE_MODEL""]","[""copy"", ""os"", ""pandas"", ""litellm"", ""logging"", ""importlib"", ""json"", ""dotenv"", ""pathlib"", ""typing"", ""pydantic"", ""openai"", ""warnings"", ""time"", ""re"", ""pdd""]",772957fe64d05fb4eca172098fc0052c277c7c3ac47a06f9dc86a0eb6b2adfa1
load_prompt_template.py,Loads prompt template files by name from configurable candidate directories using a path resolver.,"[""print_formatted"", ""load_prompt_template""]","[""pathlib"", ""typing"", ""rich"", ""pdd""]",0380b08510aee06d4e3e2b192be66475a7e3a93586b21c6fc4f9be7338bb025b
logo_animation.py,"Implements a threaded terminal logo animation that forms ASCII art from particles, holds it, then expands particles to a box perimeter using Rich for rendering.","[""AnimatedParticle"", ""start_logo_animation"", ""stop_logo_animation"", ""run_logo_animation_inline""]","[""time"", ""threading"", ""math"", ""typing"", ""dataclasses"", ""rich""]",9fa1c95b3b85cded9cb00016dbecdbc5f8ef585611238848770541b4704e923e
mcp_config.json,JSON configuration file defining an MCP text editor server that runs via npx with stdio transport.,[],[],0f772d58795286f96d6ed1f7ef36d86fab26544d15f34fe51a30ca0c8aac4811
model_tester.py,"Provides an interactive CLI tool for loading, diagnosing, and testing LLM model configurations from a user CSV, displaying results in a rich table.","[""test_model_interactive""]","[""os"", ""sys"", ""threading"", ""time"", ""pathlib"", ""typing"", ""pandas"", ""rich"", ""pdd"", ""litellm"", ""dotenv""]",2a1caa5e935c1d30dfee7540eba4880ff8dce6b45a9ac10eb26a64c48e32cfc3
one_session_sync.py,"Orchestrates a single agentic session to run example generation, crash-fix, verification, test generation, and test-fix steps for PDD module syncing.","[""build_one_session_prompt"", ""run_one_session_sync""]","[""logging"", ""threading"", ""time"", ""pathlib"", ""typing"", ""rich""]",50bdb0e40cf0e01ba5441e0a4fe0509f5b6c1e9ce531233ba85509a0f91841e2
operation_log.py,"Provides metadata path management, operation logging, fingerprint persistence, and run report handling for a prompt-driven development (PDD) sync system.","[""PDD_DIR"", ""META_DIR"", ""ensure_meta_dir"", ""get_log_path"", ""get_fingerprint_path"", ""get_run_report_path"", ""infer_module_identity"", ""load_operation_log"", ""append_log_entry"", ""create_log_entry"", ""create_manual_log_entry"", ""update_log_entry"", ""log_event"", ""save_fingerprint"", ""save_run_report"", ""clear_run_report"", ""log_operation""]","[""functools"", ""json"", ""os"", ""re"", ""time"", ""datetime"", ""pathlib"", ""typing"", ""rich""]",fdfa78636b215b118cb71f6b8945b9573857244b01226731fc7bdb08f3e092db
path_resolution.py,"Provides a configurable PathResolver for locating includes, prompt templates, data files, and project roots across multiple directory search paths.","[""PathResolver"", ""get_default_resolver"", ""IncludeProfile"", ""PromptProfile"", ""DataProfile"", ""ProjectRootProfile""]","[""__future__"", ""dataclasses"", ""os"", ""pathlib"", ""typing""]",4c513395cd96ff1fe3c01c01e6e4c2de3617332f6ff87c8391083f0c26d41d75
pdd_completion.fish,"Provides Fish shell tab-completion definitions for the PDD CLI tool, covering global options, subcommands, and command-specific flags and file-type completions.",[],[],a5f132056cc5a7799ab42fd25b60530cd6812726d8294122dd8a4f13e0fa00a5
pdd_completion.sh,"Provides Bash tab-completion for the PDD CLI tool, supporting all commands, subcommand-specific options, and filename completion.","[""_pdd"", ""_complete_files""]",[],c60c7e83a69e082ae587a96878bc893798c2b17d79617ad6c93d54e3df69dc2d
pdd_completion.zsh,"ZSH shell completion script providing tab-completion for the `pdd` (Prompt-Driven Development) CLI's subcommands, options, and arguments.","[""_pdd""]",[],57df95f23ab0de8b2395734ebe360c25fd04efbd7efc441ef826e8a35c733ef6
pddrc_initializer.py,"Provides detection, creation, and auto-generation of `.pddrc` project configuration files with language-aware defaults and directory-scanning context inference.","[""PYTHON_MARKERS"", ""TYPESCRIPT_MARKERS"", ""GO_MARKERS"", ""RUST_MARKERS"", ""LANGUAGE_DEFAULTS"", ""STANDARD_DEFAULTS"", ""PDDRC_FILENAME"", ""offer_pddrc_init"", ""infer_contexts_from_scan"", ""ensure_pddrc_for_scan""]","[""os"", ""re"", ""collections"", ""pathlib"", ""typing"", ""rich""]",108185fcb6513b50582f3c217ac95562bb12a5205ca092cf85d6cc6512bfbc66
