full_path,file_summary,key_exports,dependencies,content_hash
context/cloud_example.py,"Demonstrates usage of the pdd.core.cloud module, including URL configuration, cloud feature checks, JWT authentication flows, and endpoint listing.","[""example_get_urls"", ""example_cloud_enabled_check"", ""example_authentication_flow"", ""example_endpoint_listing"", ""main""]","[""os"", ""sys"", ""unittest"", ""pdd"", ""rich"", ""asyncio""]",92418beb7a1e7f25682bf2abce5b19013b95e7eed95256c930b83c1dd6dbfb0a
context/cloud_function_call.py,Script that calls a Firebase Cloud Function endpoint using an authenticated HTTP request with a Bearer token.,"[""call_cloud_function""]","[""requests""]",62ac7724ce2e3eddbba2b743bd7aa5790dbed34eae01e77e0252c4cc6358c95e
context/cmd_test_main_example.py,Demonstrates how to use cmd_test_main to generate unit tests for a simple calculator module by setting up input files and invoking the function programmatically.,"[""run_example""]","[""os"", ""click"", ""pathlib"", ""rich"", ""pdd""]",0774984ee29f70407429f1eff4a1b76287715b7ddd6adf2bc149e874c9b844bb
context/code_generator_example.py,Entry-point script that demonstrates the code_generator function by reading a prompt from a file and generating Python code via an LLM.,"[""main""]","[""pdd""]",4e66ed9866b05a2de791376d4881ae5d1d52ac4a6ea99176dce8febdf9a14355
context/code_generator_main_example.py,"Provides runnable, offline examples demonstrating the public surface and architecture conformance checks of the code generation orchestration module.",[],"[""json"", ""os"", ""pathlib"", ""shutil"", ""sys"", ""unittest"", ""click"", ""pdd""]",679590f0913600886d99469d8ece23fbbfe6bea2e626b0d5d2ab5fdcdc079b80
context/commands/__init___example.py,Demonstrates how to use the command registration module to set up a Click CLI with all PDD subcommands registered and categorized.,"[""cli"", ""list_registered_commands"", ""custom_cli"", ""setup_custom_cli""]","[""click"", ""pdd""]",cc6e0de7d94b1dddda35d9c8ecb800710263d928191f1d4cb2400bae36c31cb4
context/commands/analysis_example.py,"Demonstrates programmatic usage of PDD analysis CLI commands (detect, conflicts, bug, crash, trace) by invoking their Click callbacks with dummy data.","[""OUTPUT_DIR"", ""clean_output"", ""main""]","[""os"", ""click"", ""shutil"", ""pdd""]",01ff82910c50ec8f8cfd22f8e3b7c011f286a4b9f90e7dd5b2eb685c1f339e56
context/commands/auth_example.py,Example CLI entry point that registers the PDD auth command group and demonstrates its usage via Click.,"[""cli""]","[""click"", ""sys"", ""os"", ""pdd""]",d1e77e2ab5a5b6f3c400a8a68a73bb633f6d45e39dd4a90306dcc18c729d9000
context/commands/checkup_example.py,Provides example script functions demonstrating how to run the CLI checkup command in various modes using mock testing.,"[""example_github_issue_mode"", ""example_pr_review_loop_mode"", ""example_local_validation_mode""]","[""__future__"", ""sys"", ""pathlib"", ""unittest"", ""click"", ""pdd""]",847008502198ff360190831172d5d6cc6de6e5e76d3782d2b53823297a5b1349
context/commands/connect_example.py,"Demonstrates and tests the PDD `connect` command by mocking server startup, browser opening, security warnings, and custom frontend URLs.","[""example_integrate_into_cli"", ""example_simulate_server_start"", ""example_security_warning"", ""example_custom_frontend""]","[""sys"", ""os"", ""pathlib"", ""unittest"", ""click""]",d2bcda4ae1e9de22d1b657c28045a0b122dc1ef22a77e4d670f41229779a6083
context/commands/fix_example.py,"Demonstrates and tests the three routing modes (agentic, user-story, manual) of the `fix` CLI command using mocked backends.","[""run_agentic_example"", ""run_user_story_example"", ""run_manual_example""]","[""sys"", ""pathlib"", ""unittest"", ""click"", ""pdd""]",4b2db39fec015e750d59894877e7dc630152aff56fe262dee275f03ba2c6f97d
context/commands/generate_example.py,"Provides examples and demonstrations for programmatically and CLI-based usage of the PDD generation, example, and test commands.","[""setup_output_directory"", ""create_sample_prompt_file"", ""create_sample_code_file"", ""example_generate_command"", ""example_example_command"", ""example_test_command"", ""example_programmatic_invocation"", ""example_template_usage"", ""example_project_root_usage"", ""main""]","[""os"", ""sys"", ""pathlib"", ""typing"", ""click"", ""pdd""]",3bce1d85d05b3fa6ee5edf5e8380f52ac4e15154ba08286def933a3833b26347
context/commands/maintenance_example.py,"Demonstrates usage of PDD maintenance CLI commands (sync, auto-deps, setup) via Click's CliRunner with mocked backends.","[""setup_output_directory"", ""create_mock_project"", ""example_sync_command"", ""example_sync_dry_run"", ""example_sync_github_issue"", ""example_auto_deps_command"", ""example_setup_command"", ""example_deprecated_log_flag"", ""main""]","[""os"", ""shutil"", ""pathlib"", ""unittest"", ""click"", ""pdd""]",deb03dae384e78899facb1f392f8bd9ef9353d11d5ee5640142ea2199f8e16b6
context/commands/misc_example.py,"Demonstrates usage of the pdd preprocess Click command with examples covering basic preprocessing, XML delimiters, curly bracket doubling, recursive includes, and combined options.","[""setup_example_files"", ""example_basic_preprocess"", ""example_xml_preprocessing"", ""example_double_curly_brackets"", ""example_recursive_preprocessing"", ""example_combined_options""]","[""os"", ""click"", ""pdd""]",7d7985d21dd7b962257856cb92d13e26c016bc09ce14aaac4c68baaead97dc4b
context/commands/modify_example.py,"Demonstrates how to invoke and test the split, change, and update CLI commands using mocked external dependencies to run offline.",[],"[""__future__"", ""os"", ""sys"", ""tempfile"", ""pathlib"", ""unittest"", ""click"", ""pdd""]",84edd899e3202fe13dc2e9437505a85552ec870b325e5628727d7202371d8134
context/commands/sessions_example.py,Demonstrates and tests the PDD 'sessions' CLI commands by mocking internal package dependencies and invoking subcommands programmatically via CliRunner.,"[""DummySession"", ""run_example""]","[""asyncio"", ""sys"", ""unittest"", ""click"", ""rich""]",d235c7a2fad154663ce3016baa1babd45a1b5fa5041ba130024dbe88ab791a28
context/commands/templates_example.py,"Demonstrates programmatic invocation of PDD CLI template commands (list, show, copy) using Click's test runner.","[""example_list_templates"", ""example_show_template"", ""example_copy_template"", ""main""]","[""os"", ""sys"", ""pathlib"", ""click"", ""pdd""]",017d7a9cbdec60dd67cee662f3b21a68638137cd086fb335ef92889e1d91b09a
context/commands/utility_example.py,Demonstrates usage of PDD utility CLI commands (install_completion and verify) by creating example files and showing invocation patterns.,"[""setup_output_directory"", ""create_example_files"", ""demonstrate_install_completion"", ""demonstrate_verify_command"", ""show_return_value_structure"", ""main""]","[""os"", ""sys"", ""textwrap"", ""pathlib"", ""click"", ""rich"", ""pdd""]",fb7389c0ec837b8b6ee481e2eda04800f565fe247643f5bb9922dd1dfdab984a
context/comment_line_example.py,Demonstrates usage of the `comment_line` function for commenting out code lines using various comment styles or deleting them.,[],"[""comment_line""]",debc424d539b65aef1267888bb2eb77cf4de16745407bb5df5a18b8e2f231095
context/config_example.py,Initializes application configuration at module load time by calling init_config from the utils.config module.,[],"[""utils""]",9440de90fa1ba1ed48f0bf1a080357ef15080d4406bc6f90c794f1eb539c8c40
context/conflicts_in_prompts_example.py,Demonstrates conflict detection between two LLM prompts using the conflicts_in_prompts function with example Firebase project prompts.,"[""main""]","[""tabnanny"", ""pdd"", ""rich""]",d286f38ca6e43216d62197230f6c53ec665734db782d965e5448f8e9f8bbdfb2
context/conflicts_main_example.py,Script that demonstrates usage of the conflicts_main function by creating example prompt files and running conflict detection between two prompts.,[],"[""pdd""]",36e9f73fd888af26dc73f35ee765715e99e4325881bc0ffdc5d70106eda7e239
context/construct_paths_example.py,"Demo script that exercises the `construct_paths` helper end-to-end by creating a temporary prompt file, invoking the function, and printing its return values.",[],"[""os"", ""pathlib"", ""pdd""]",9fb88745a2a0e2834f9da30c2128a122fef4d5a74212ceacc5f9c3d9ddb9a8ca
context/content_selector_example.py,"Demonstrates all ContentSelector capabilities including line, def, class, section, pattern, JSON/YAML path selectors, interface mode, and error handling.","[""main"", ""separator"", ""SAMPLE_PYTHON"", ""SAMPLE_MARKDOWN"", ""SAMPLE_JSON"", ""SAMPLE_YAML""]","[""json"", ""os"", ""sys"", ""textwrap"", ""pdd""]",1b71d5d614f81c6543cc3a437ed8fcaa810372b06dc9bf23bde3cd09d9d715e6
context/context_generator_example.py,Script demonstrating usage of the context_generator function to generate example code from a prompt and code module.,[],"[""os"", ""pdd"", ""rich""]",277b54ee71ffc836d9db9ad4d4fc0b3fee365ce6f5691222acad11b58461923b
context/context_generator_main_example.py,"Demonstrates usage of context_generator_main by setting up mock inputs, a Click context, and invoking LLM-based example code generation.","[""run_example""]","[""os"", ""asyncio"", ""pathlib"", ""click"", ""pdd""]",77c3de786f31392540ec609d4b3942e98e996ae14c4014f5018cf2b05a560df4
context/continue_generation_example.py,Script that demonstrates continuing LLM text generation by loading context files and writing the completed output.,"[""main""]","[""pdd""]",29c33a967bcdf4fa0037e1c7b0ec699c00027606dbe9d93fa4d1434f9c16c19e
context/core/cli_example.py,"Demonstrates programmatic usage of the PDD CLI entry point, global options, and the custom PDDCLI Click Group class via CliRunner examples.","[""example_show_help"", ""example_show_version"", ""example_list_contexts"", ""example_invoke_with_global_options"", ""example_quiet_mode"", ""example_cost_tracking_setup"", ""example_context_override"", ""example_core_dump_flag"", ""example_pddcli_class_usage"", ""main""]","[""os"", ""sys"", ""click"", ""pdd""]",48068766551cf90d9fdca612b4210b4d901441931e3578e23fbf72083e95e075
context/core/cloud_example.py,"Demonstrates usage of the CloudConfig module for URL configuration, cloud enablement checks, JWT token handling, and timeout settings.",[],"[""asyncio"", ""os"", ""sys"", ""unittest""]",8a14ae9e69dbccfbbfffd9bde1ea11192334a10aaf9d5b5e6dba5ac23ba0dd90
context/core/dump_example.py,"Demonstrates usage of the pdd.core.dump module for generating core dumps, replay scripts, GitHub issue markdown, and posting issues.","[""example_write_core_dump"", ""example_github_config"", ""example_write_replay_script"", ""example_build_issue_markdown"", ""example_post_issue_to_github""]","[""os"", ""sys"", ""json"", ""tempfile"", ""pathlib"", ""unittest"", ""pdd""]",0416a935ac490b958ceedfc6e68c7fbd7e383966374ba13ccf7ebfeaf8ad0803
context/core/duplicate_cli_guard_example.py,"Provides a command-line interface implementation and example script demonstrating the use of guards to prevent redundant, expensive duplicate operations.","[""cli"", ""generate"", ""run_example""]","[""os"", ""sys"", ""click"", ""pathlib"", ""pdd""]",947ec40a9a778e302a6d217b16ce7e65df82cda777c3361915cc635ba106de83
context/core/errors_example.py,"Demonstrates usage of the pdd.core.errors module for centralized error handling, Rich console output, error buffering, and core dump generation.","[""main""]","[""os"", ""json"", ""pdd""]",b50dbf08aec028bd57a8fe74762bf92aee9a1fe953fb3d7db50cc686c72bfee3
context/core/utils_example.py,"Demonstrates usage of PDD CLI utility functions for command detection, environment validation, shell completion checks, and interactive setup initialization.","[""example_first_pending_command"", ""example_api_env_exists"", ""example_completion_installed"", ""example_project_has_local_configuration"", ""example_should_show_onboarding_reminder"", ""example_run_setup_utility_info"", ""main""]","[""os"", ""sys"", ""pathlib"", ""unittest"", ""pdd""]",ecda9cd9c5910246e0f857eacacac6ec381eb531695e5a56670a9dd8c02c0ef1
context/crash_main_example.py,Demonstrates using the crash_main function to automatically fix a crashed program by setting up dummy files and invoking the repair pipeline.,"[""run_crash_fix_example""]","[""click"", ""os"", ""pathlib"", ""rich"", ""pdd""]",5c9b909107f74f773ccf7013d556a5812643d2a3b086e79fe07da7ea7877458c
context/detect_change_example.py,Script that runs change detection on a set of prompt files using an LLM and displays the results via Rich console.,[],"[""pdd"", ""rich"", ""pathlib""]",44d0c9172db01bd645d48a11a7afa527a7e509f5aac911fa41ed091d3f982096
context/detect_change_main_example.py,Script that simulates CLI parameters and invokes detect_change_main to analyze prompt files for needed changes.,"[""main""]","[""click"", ""pdd"", ""os""]",ddc494709d127398004f53de58bede388692b2839a97b26668c55575369d9edd
context/dict_utils_example.py,"Example script demonstrating dict_utils module features including deep merge, flatten/unflatten, filter keys, and nested value access.",[],"[""sys"", ""os"", ""json"", ""dict_utils""]",4c123047dc113ec65a2fccf858e047a7379382ac66d09029037dd7489b6f113f
context/edit_file_example.py,Sets up environment configurations and creates dummy files to test and verify the functionality of a subprocess-based file editing agent.,"[""create_example_files"", ""run_edit_file_test"", ""run_example""]","[""os"", ""sys"", ""json"", ""pdd""]",272d1967123c63800bb6afff073cf409edd71e598bcd904fa9852e0a482f87e3
context/embed_retrieve_example.py,"Demonstrates usage of the embed_retrieve module for embedding-based semantic retrieval, including basic ranking, edge cases, API failure fallback, and custom model configuration.","[""make_mock_embedding_response"", ""example_basic_retrieval"", ""example_edge_cases"", ""example_api_failure_fallback"", ""example_custom_model""]","[""os"", ""sys"", ""unittest"", ""pdd""]",17920a5c72ada21b31f6df15d9ad156d67ebaf8f141c3839b068d9379360cd84
context/extracts_prune_example.py,Demonstrates programmatic and CLI usage of the `pdd extracts prune` command for deleting orphaned extract cache entries.,"[""example_prune_with_force"", ""example_prune_interactive"", ""example_prune_global_force"", ""example_prune_no_cache"", ""example_inspect_orphans"", ""example_testing_support""]","[""hashlib"", ""json"", ""os"", ""sys"", ""tempfile"", ""pathlib"", ""unittest"", ""click"", ""pdd""]",b8a894f24d715f42be14b9977b6c091e75401e3f46f0722703fa63b61b26a7ee
context/fastapi_example.py,"Defines a FastAPI application factory for a PDD local REST server with status, file operations, and command execution endpoints.","[""create_app"", ""ServerStatus"", ""FileMetadata"", ""FileContent"", ""CommandRequest"", ""JobHandle"", ""AppState"", ""get_app_state"", ""create_status_router"", ""create_files_router"", ""create_commands_router"", ""main"", ""lifespan""]","[""contextlib"", ""datetime"", ""pathlib"", ""typing"", ""fastapi"", ""pydantic""]",4b3d64175b8f46b48a4387e9cf98ed4024fd74a57413bd2f8a55c5d9c3dd0108
context/find_section_example.py,Demonstrates usage of the `find_section` function to extract fenced code block locations and languages from multi-line text.,[],"[""pdd""]",681043403aa02b9eb0d265a95560fce565507d0656d1693f79650f8eb5f0683a
context/firecrawl_example.py,Demonstrates using Firecrawl for web scraping with both direct API usage and cache-aware patterns in PDD.,[],"[""firecrawl"", ""os"", ""pdd""]",4674cc7e418515545b7df1d025fd024ce2006932ede48cebc5c067bc6756f3f1
context/fix_code_loop_example.py,Demonstrates the fix_code_loop module by creating buggy dummy files and running an automated code repair loop with configurable LLM parameters.,"[""create_dummy_files"", ""main""]","[""os"", ""sys"", ""pathlib"", ""rich"", ""fix_code_loop""]",c512f0f317474550a9ed74b5211ae0eab62c3f04115db14af67a88033aacfa87
context/fix_code_module_errors_example.py,Demonstrates usage of the fix_code_module_errors function by providing a sample program with a TypeError and attempting to fix it via LLM.,"[""main""]","[""pdd""]",f35244d6e920711044fee92ade984f3e820a0fbfe766fd3d49718cbcfe793e60
context/fix_error_loop_example.py,Demonstrates using the `fix_error_loop` function to iteratively repair a buggy Python function via LLM-based code fixing with unit tests.,"[""main""]","[""os"", ""sys"", ""pathlib"", ""rich"", ""pdd""]",09aeef3c02612c54ba643feca7e2e692adaa1cec9fa1217a61507fec031929cc
context/fix_errors_from_unit_tests_example.py,Demonstrates the fix_errors_from_unit_tests function by running it with example inputs and printing the results.,"[""main""]","[""os"", ""pdd"", ""rich""]",df6c93b3ae585af13827cf3edb398e7c0da75648b34ff0477044b659df85a117
context/fix_main_example.py,"Demonstrates using the `fix_main` function to iteratively fix buggy code by setting up mock files, a Click context, and running both loop and single-pass modes.","[""main""]","[""os"", ""sys"", ""click"", ""pathlib"", ""rich"", ""pdd""]",29f88d8bfcc2256ebebe6efcb611f9487eb5ca6d8781286a6dd98689f92bca7a
context/fix_verification_errors_example.py,Example script demonstrating how to use the `fix_verification_errors` function from the pdd package to identify and fix bugs in code via LLM-driven verification.,[],"[""rich"", ""pdd""]",087d89544db864fe4c8025124ce2fd3fdf9f621c988bd415ba9a0ba942d2f497
context/fix_verification_errors_loop_example.py,Demo script that sets up a buggy calculator module and runs fix_verification_errors_loop to automatically correct the code using an LLM.,"[""setup_demo_environment"", ""main""]","[""os"", ""sys"", ""shutil"", ""pathlib"", ""rich"", ""pdd""]",0212e6010a7c163c476c3df095f6ca99414829f73df34c60651afae83633d307
context/fix_verification_main_example.py,Demonstrates the fix_verification_main module by creating dummy calculator files with an intentional bug and running the verification/fix pipeline.,"[""create_dummy_files"", ""main""]","[""os"", ""sys"", ""click"", ""pathlib"", ""rich"", ""pdd""]",6490f398aca6df47b1a95e46a4ecfc0aabe299b5022de5c31ebc436e1bc3e459
context/gemini_may_pro_example.py,Demonstrates a simple API call to Google's Gemini model via LiteLLM's completion interface.,[],"[""litellm""]",50c14eac723918c8a752ccc66d12eac4220d5ac62620bbf0c5e21bd821f08734
context/generate_model_catalog_example.py,Provides example usage and validation for the model catalog generation process using agent-reviewed manifest data.,[],"[""json"", ""subprocess"", ""sys"", ""tempfile"", ""pathlib"", ""pdd""]",44157c26beba999e90db7480ce87f26060f25cbf6cdf06643f5af9d5f8001acc
context/generate_output_paths_example.py,Example script demonstrating various usage scenarios of the `generate_output_paths` function for resolving output file paths across different commands and input configurations.,[],"[""os"", ""sys"", ""typing"", ""pdd""]",0f8a6384ebfe9dc3ea448a4df7b4f5ebf9aa9b714f67a4322437638700a4307f
context/generate_test_example.py,Example script demonstrating how to use the `generate_test` function to create unit tests from code and a prompt.,[],"[""os"", ""pdd"", ""rich""]",f73533a9cf63f2e2f4818ee923a8500e612d155e230017dbdb35aec945e41998
context/generation_completion_example.py,Demonstrates the use of generation completion helpers to verify if LLM outputs are both provider-finished and structurally valid across multiple formats.,"[""main""]","[""sys"", ""pathlib"", ""pdd""]",84f4a9f8ef36a750f6c15b4be89673d4ef6c9af5c81972173cac90f1f9876ae4
context/get_comment_example.py,Example script and documentation demonstrating usage of the `get_comment` function to retrieve comment characters for various programming languages.,[],"[""pdd""]",3293b4631db7c783d87745abf36a79996d5c182b74e8bee885a2e522550db851
context/get_extension_example.py,Script that demonstrates usage of the get_extension function by printing file extensions for various language names.,[],"[""pdd""]",def9c34c1416259a0a031a996b96aeff5e73a7012adff6af1cc557e74ba97cc8
context/get_jwt_token_example.py,This script facilitates user authentication via GitHub Device Flow to obtain and store a Firebase JWT token in an environment-specific configuration file.,[],"[""asyncio"", ""os"", ""pathlib"", ""pdd""]",76a87c8257cb1f4cfdc2edff6225c752432afb3a5e352fcb016d08d8eae16e01
context/get_language_example.py,Demonstrates usage of the get_language function by looking up the programming language for a given file extension.,"[""main""]","[""pdd""]",8b09af25b96fa49e2dcf5ff307bbeb0bc83e84b64618971d393397772a2fafab
context/get_run_command_example.py,Demonstrates usage of the get_run_command module for retrieving language-specific run commands based on file extensions.,"[""main""]","[""pdd""]",4d187e844adb255c2738274556f4828728d0d73d84ebf8bda885d51d4be9414f
context/get_test_command_example.py,Demonstrates usage of get_test_command_for_file() to resolve appropriate test commands for various file types using layered detection strategies.,"[""demonstrate_python_test"", ""demonstrate_javascript_test"", ""demonstrate_language_override"", ""demonstrate_multiple_files"", ""demonstrate_handling_none_result"", ""main""]","[""pathlib"", ""rich"", ""pdd""]",33b16476536f8c9424d3222ffc4a5cd5ecee6ad0589b2c66a4f3c7f1e265106c
context/git_update_example.py,Script demonstrating usage of the git_update function to update prompts via agentic or legacy paths.,[],"[""os"", ""pdd""]",811304cee2cb890879ee68a816aed49dff2e7b50cfdca3125e16e0ae99819574
context/include_query_extractor_example.py,"Demonstrates usage of IncludeQueryExtractor with mocked LLM calls, showcasing caching, staleness detection, metadata verification, and cache toggle via environment variable.","[""main""]","[""json"", ""os"", ""shutil"", ""tempfile"", ""unittest"", ""pdd""]",48b75db510e0087d72cb58c8f5495ca9f54bf31411e8a30f8ce2b69b93d9eaf0
context/increase_tests_example.py,Demonstrates basic and advanced usage of the `increase_tests` function to generate more comprehensive unit tests from existing code and coverage reports.,"[""example_usage""]","[""pdd""]",f53be429e9a9e6a523c770ed6d0d4498e2201b22d5a8e4ef28ac64e8ff172c91
context/incremental_code_generator_example.py,Demonstrates incremental code generation by applying a minimal diff to existing code using the `pdd` package's LLM-based tools.,"[""main""]","[""pdd"", ""rich""]",f6cd628ddc2c10853a15c449b32451a1290d2457942d642989678720bc0cea82
context/insert_includes_example.py,"Demonstrates and tests the insert_includes function with 10 scenarios covering dependency insertion, update-only mode, dedup, CSV auto-creation, progress callbacks, parameter pass-through, and error handling.",[],"[""os"", ""sys"", ""tempfile"", ""shutil"", ""unittest""]",c304bf4656f75fa26192c92b3eb0422a903d8a1bc82dda3158dc9f184b337873
context/install_completion_example.py,Demonstrates usage of the PDD shell completion installation module by setting up a dummy environment and invoking completion installation functions.,"[""setup_example_environment"", ""main""]","[""os"", ""rich"", ""pdd""]",999be17c0ce476845d7048a1a909ad425e60c298dbc7c74f51b596ef134a8aec
context/job_manager_example.py,"Provides an async job queue manager with submission, concurrent execution, status tracking, cancellation, and lifecycle callback support for a PDD server.","[""JobStatus"", ""Job"", ""JobManager"", ""JobCallbacks""]","[""asyncio"", ""concurrent"", ""dataclasses"", ""datetime"", ""enum"", ""typing"", ""uuid""]",e421698fdf16c5dfebf97eb3f2cb7210878efa1869804f871100489e35102543
context/langchain_lcel_example.py,"Demonstrates LangChain LLM integrations (OpenAI, Google, Anthropic, Groq, Together, Ollama, MLX, Bedrock) with prompt templates, output parsers, structured output, fallbacks, and configurable alternatives.","[""CompletionStatusHandler"", ""Joke""]","[""os"", ""json"", ""pydantic"", ""langchain_core"", ""langchain_community"", ""langchain"", ""langchain_openai"", ""langchain_fireworks"", ""langchain_anthropic"", ""langchain_google_genai"", ""langchain_google_vertexai"", ""langchain_groq"", ""langchain_together"", ""langchain_ollama"", ""langchain_aws""]",cffe5f77babeb7ac27dc42383a99a03f5a9f55ae1d6f2472e5f9863df0a84daf
context/list_stats_example.py,"Demonstrates usage of the list_stats module's statistical functions including safe_mean, median, variance, and percentile on sample data.","[""main""]","[""sys"", ""os"", ""list_stats""]",46ae10331f07afe5a953030db2cb03cc02109518f4fa95b0b49dcfb784e85462
context/llm_invoke_example.py,"Provides demonstration examples for utilizing the pdd package's LLM invocation features including basic prompts, structured Pydantic outputs, batch processing, and reasoning modes.","[""run_llm_invoke_examples""]","[""os"", ""sys"", ""json"", ""typing"", ""pydantic"", ""pdd""]",d749aa00a35c88c254c4aaa9e1280d85342d71214710e2f3f7a2bd9388a92168
context/llm_model_ranges_example.py,Script that calculates LLM model strength ranges and tests each model by invoking it at its midpoint strength value.,"[""calculate_model_ranges"", ""main""]","[""os"", ""sys"", ""typing"", ""pdd""]",6a7c6f17b8bd1ce7ad19c07d414366d384be9abf392c5e6085a4a5627fe2309d
context/llm_selector_example.py,Demonstrates usage of the llm_selector function by iterating over strength values and printing selected model details and token counts.,"[""main""]","[""pdd""]",0a8259580406d3c7ba68ee57230cacc49a5446e488433bf85c44958ab0b07541
context/load_prompt_template_example.py,"Script that loads and displays a prompt template named ""generate_test_LLM"" using rich-formatted console output.",[],"[""pdd"", ""rich""]",a1cd6619182c6c951f5856dda4070e202875a5884bbfab9cc191d24de2f4951f
context/logo_animation_example.py,"Demonstrates the PDD branding logo animation by starting it in a background thread, waiting, and then stopping it.","[""main""]","[""time"", ""pdd""]",f32a5cc330235c3b61fb16ac62d3ae7531c7c6dbc11af077fc79054736f0944d
