full_path,file_summary,date
"context/crash_main_example.py","This Python script demonstrates the usage of `crash_main` function from the `pdd` library, which is designed to automatically fix code errors that cause program crashes. The script first creates necessary example files in an output directory including: 1) a prompt requesting a factorial function implementation, 2) a factorial.py module with an intentional bug (doesn't handle negative numbers), 3) a main.py program that incorrectly calls factorial with a negative number, and 4) an error log showing the resulting recursion error. The demonstration then creates a Click context with model parameters and calls the `crash_main` function to automatically fix both the factorial implementation and the calling program. The function is configured to make up to two fix attempts, with a $5 budget limit, and can operate iteratively. After execution, the script displays whether the fix was successful, the number of attempts made, the cost incurred, the AI model used, and prints the fixed code for both files. This demonstrates an automated debugging workflow that uses AI to identify and repair programming errors across interrelated files.",2025-03-19T23:31:14.660248+00:00
"context/detect_change_example.py","The provided script is a Python program designed to analyze and detect changes in prompt files using a machine learning model. It imports necessary modules, including 'detect_change' from 'pdd.detect_change', and utilizes the 'rich.console' library for formatted console output. The script defines a list of prompt files located in 'context' and 'prompts' directories, which are analyzed for changes based on a given description. The change description specifies the goal of making prompts more compact using a specific file ('context/python_preamble.prompt').

The script sets parameters for the machine learning model, such as 'strength' (determining model intensity) and 'temperature' (controlling randomness in output). It then attempts to detect changes in the prompt files by calling the 'detect_change' function with the specified parameters. If successful, it prints the detected changes, including the prompt name and change instructions, along with the total cost of the operation and the model used. In case of an error, it catches the exception and displays an error message.

Overall, the script automates the process of analyzing and updating prompt files to improve their compactness and efficiency, while providing detailed feedback and cost analysis.",2025-01-01T07:17:53.244881+00:00
"context/detect_change_main_example.py","The provided code is a Python script that utilizes the Click library to simulate command-line interface (CLI) parameters and invoke a function named `detect_change_main` from the `pdd.detect_change_main` module. The script defines a main function that sets up a Click context with specific model parameters, including strength, temperature, force, and quiet options. It specifies a list of prompt files and a change description file, which is written to a specified output file. The script ensures that the output directory exists before calling the `detect_change_main` function, which processes the prompts and generates a list of changes needed, along with the total cost and model name used. The results, including the model name, total cost, and detailed change instructions for each prompt, are printed to the console. The script is designed to handle exceptions gracefully, providing error messages if any issues arise during execution. Overall, this script serves as a utility for detecting changes in prompts based on specified criteria.",2025-02-09T07:16:47.203735+00:00
"context/edit_file_example.py","The provided script is a Python program designed to facilitate the editing of text files using a specified editing module, `edit_file.py`. It begins by configuring the environment, ensuring that the necessary paths are set up correctly, particularly the `PDD_PATH` environment variable, which points to the directory where output files will be created. The script defines a function to create a dummy text file with initial content and a set of instructions for editing this file. The main functionality is encapsulated in the `run_edit_file_test` function, which executes the editing process based on the provided instructions and verifies the results. The script includes error handling to manage issues such as missing modules or incorrect paths. The `run_example` function orchestrates the creation of example files and the execution of the editing tests. It emphasizes the need for certain prerequisites, including the installation of required packages and the availability of API keys for language model services. The script concludes by running the example function if executed as the main program, ensuring that all necessary conditions are met before proceeding.",2025-04-15T07:05:56.343481+00:00
"context/execute_bug_to_unit_test_failure.py","The provided code snippet imports a function named 'add' from a module called 'context.bug_to_unit_test_failure_example'. It then calls this 'add' function with two arguments, 2 and 3, and prints the result. The purpose of this code is to demonstrate a simple addition operation, where the expected output would be the sum of the two numbers, which is 5. This example may be part of a larger context where the function 'add' is being tested or utilized, possibly in relation to debugging or unit testing scenarios.",2025-02-09T07:16:50.487380+00:00
"context/final_llm_output.py","The provided code is a command-line interface (CLI) for a tool called PDD (Prompt-Driven Development), which facilitates the generation, modification, and testing of code based on user prompts. It utilizes the Click library for command handling and Rich for console output. The CLI supports various commands such as generating runnable code from prompts, creating example files, generating unit tests, preprocessing prompts, fixing errors in code and tests, and splitting large prompts into smaller ones. Each command is designed to handle specific tasks, with options for output file paths, verbosity, and cost tracking. The code includes error handling to manage exceptions during execution and provides feedback to the user through console messages. Additionally, it features a cost tracking mechanism to log the expenses associated with each operation in a CSV file. The CLI also supports shell completion installation for user convenience and displays the version of the tool. Overall, the code is structured to enhance the development workflow by automating code generation and testing processes.",2025-02-09T07:16:53.927541+00:00
"context/find_section_example.py","This file provides documentation and examples for using the `find_section` function from the `find_section.py` module. The function is designed to identify and extract code blocks from text content. The documentation includes a complete example that demonstrates how to use the function with a sample input containing multiple code blocks in different programming languages (Python and JavaScript). The file details both the input parameters (`lines`, `start_index`, and `sub_section`) and the output format (a list of tuples containing language, start line, and end line information). The example shows how to process a string containing code blocks by first splitting it into lines and then using the find_section function to locate the code sections. It also includes a practical example of reading from a file ('unrunnable_raw_llm_output.py') and processing its contents. The documentation concludes with sample output showing how the function identifies code blocks and their locations within the text. The function appears to be particularly useful for parsing and processing text that contains embedded code blocks in various programming languages.",2024-12-07T01:53:08.778520+00:00
"context/firecrawl_example.py","This code demonstrates the usage of the Firecrawl Python library for web scraping. The example begins with installation instructions via pip and imports the necessary FirecrawlApp class along with the os module. It initializes a FirecrawlApp instance using an API key either from environment variables or a placeholder value. The code then makes a request to scrape 'google.com' specifically requesting the content in markdown format. The script prints the response, which contains both the scraped content and metadata about the operation. The response shows Google's homepage content converted to markdown, including navigation links (About, Store, Gmail, Images), sign-in options, the Google logo, search features, various 'I'm Feeling...' options, and footer links (Advertising, Business, Privacy, Terms). The metadata section includes information such as the page title, language, scrape ID, source URL, final URL, and HTTP status code. This serves as a practical example of how to extract and format web content using the Firecrawl library.",2025-03-19T23:31:14.677508+00:00
"context/fix_code_loop_example.py","The provided Python script demonstrates the use of a function called `fix_code_loop` to iteratively debug and fix a code file. The script begins by creating example files: a Python module (`module_to_test.py`) containing a function `calculate_average` that calculates the average of a list of numbers, and a verification script (`verify_code.py`) that tests this function with an erroneous input (a string instead of a list). The script also defines a prompt describing the intended functionality of the code. The `fix_code_loop` function is then invoked with parameters such as the code file, verification program, prompt, and constraints like model strength, temperature, maximum attempts, and budget. The loop attempts to fix the code iteratively, logging errors and outputs, until the code passes the verification or the constraints are exhausted. The results, including success status, number of attempts, cost, and the final code, are printed. The script also includes commented-out code for cleaning up the generated files. This script serves as an example of automated debugging and code correction using a predefined loop mechanism.",2025-01-01T07:17:58.918831+00:00
"context/fix_code_module_errors_example.py","The provided Python script demonstrates a process for identifying and fixing errors in a code module using a function called `fix_code_module_errors`. The script begins with a sample program that contains an error, where a function `calculate_sum` attempts to sum a string instead of a list of numbers, resulting in a `TypeError`. The script also includes the original prompt that generated the code, the erroneous code module, and the error message encountered during execution. The `fix_code_module_errors` function is then called with these inputs, along with parameters such as model strength and temperature, to generate a corrected version of the program and code module. The function returns several outputs, including whether updates are needed, the fixed program and code, the total cost of the API calls, and the name of the model used. The script concludes by printing these results, providing a clear demonstration of how the error was identified and resolved. This script serves as an example of automated debugging and code correction using external tools or APIs.",2025-01-01T07:18:02.055770+00:00
"context/fix_error_loop_example.py","This Python script demonstrates the usage of the 'fix_error_loop' function from the pdd module, which appears to be designed for automated code error correction. The main function establishes various parameters for the error-fixing process, including paths to a unit test file, a code file, a prompt file containing instructions, and a verification program. It also defines operational parameters such as strength (0.85), temperature (1), maximum attempts (5), and a budget limit (100.0). The script loads a prompt from a file, then calls the fix_error_loop function with all the configured parameters. Upon completion, it displays the results using Rich library's formatting capabilities, showing whether the error correction was successful, the number of attempts made, the total cost incurred, the model name used, and the final versions of both the unit test and code files. The implementation includes error handling to catch and display any exceptions that might occur during execution. The script is designed to run as a standalone demonstration when executed directly.",2025-04-05T08:29:37.224693+00:00
"context/fix_errors_from_unit_tests_example.py","This Python file demonstrates the usage of the 'fix_errors_from_unit_tests' function from the pdd module. The script sets up example inputs including a unit test for an 'add' function, a code implementation with potential issues, a prompt describing the function's purpose, and an error message from a failed test. The example unit test contains an incorrect assertion (expecting 0+0=1), while the code implementation includes a deprecated NumPy function. The script calls the fix_errors_from_unit_tests function with these inputs along with parameters like error logging file path, LLM strength (0.85), and temperature (1.0). After processing, it prints the results including whether the unit test and code should be updated, the fixed versions of both, analysis results, the cost of the operation, and the model name used. This appears to be a demonstration of an AI-powered tool that can automatically diagnose and fix code issues based on failing unit tests, using language models to generate corrections.",2025-04-05T08:29:37.236985+00:00
"context/fix_main_example.py","This Python script defines a command-line interface for a code fixing tool using the Click library. The main function `fix_command` acts as an entry point that processes various command-line arguments and passes them to a `fix_main` function from the pdd module. The tool is designed to automatically fix errors in both code files and unit tests.

The command requires several inputs including paths to prompt files, code files, unit test files, and error logs. It also accepts optional parameters like output paths, maximum fix attempts (default 3), budget constraints (default $5.0), and whether to use iterative fixing.

Upon completion, the script reports success or failure with colored output using the rich library, and provides metrics including the number of attempts, cost, and model used. The script includes a hardcoded example in the main block that demonstrates how to use the tool for a specific file called 'get_extension.py', complete with test files and verification program. This appears to be part of a larger debugging or development toolkit.",2025-03-19T23:31:14.693282+00:00
"context/generate_output_paths_example.py","The file is a Python script that demonstrates the usage of a function called `generate_output_paths` from the `pdd.generate_output_paths` module. The script sets up example inputs, including a command, output locations, a basename, a programming language, and a file extension. It then calls the `generate_output_paths` function to generate output paths based on these inputs. The script includes examples for different scenarios: a basic 'generate' command, a case where an environment variable (`PDD_GENERATE_OUTPUT_PATH`) is used to specify the output path, and a 'fix' command that generates multiple output paths for test and code files. The results of these function calls are printed to the console, showcasing the generated output paths for each scenario. The script is structured to demonstrate the flexibility and functionality of the `generate_output_paths` function in handling various input configurations and commands.",2024-12-13T21:07:19.225256+00:00
"context/generate_test_example.py","The file contains a Python script that demonstrates the generation of a unit test for a given function using the `generate_test` function from the `pdd.generate_test` module. The script begins by importing necessary modules, including `os` and `rich` for environment variable handling and formatted output, respectively. It defines a prompt for creating a factorial function, along with the corresponding Python code implementation. Additional parameters such as `strength`, `temperature`, and `language` are specified to guide the test generation process. The script attempts to call the `generate_test` function with these inputs and captures the resulting unit test, total cost, and model name. If successful, it prints the generated unit test, cost, and model details using formatted output. In case of an error, it catches the exception and displays an error message. The script also includes commented-out code for setting an environment variable (`PDD_PATH`) if needed.",2024-12-21T03:10:34.209936+00:00
"context/get_comment_example.py","The provided document outlines the usage and documentation for the `get_comment` function from the `get_comment.py` module. It begins with an example of how to import and utilize the function, demonstrating its application for various programming languages such as Python, Java, and JavaScript. The function is designed to return the appropriate comment character(s) based on the specified programming language, with case insensitivity for the input. The documentation details the input parameter, which is a string representing the programming language, and the output, which is a string of the comment character(s). In cases where the environment variable `PDD_PATH` is not set, or if the language is not found in the associated CSV file, the function will return 'del'. Additionally, the document emphasizes the importance of setting the `PDD_PATH` environment variable correctly and mentions the structure of the required CSV file, which should include columns for `language` and `comment`.",2025-02-09T07:17:07.729500+00:00
"context/get_extension_example.py","The provided code snippet demonstrates the usage of a function named 'get_extension' imported from the 'pdd' module. This function is designed to return the file extension associated with various programming languages. Three example calls to the function are included, showcasing its functionality. The first call, with the argument 'Python', returns the output '.py', indicating the standard file extension for Python scripts. The second call uses 'Makefile' as an argument, which returns 'Makefile', reflecting that Makefiles do not have a specific extension. The third example, with 'JavaScript', returns '.js', the common file extension for JavaScript files. Overall, the snippet serves as a simple demonstration of how to retrieve file extensions for different programming languages using the 'get_extension' function.",2025-02-09T07:17:10.534224+00:00
"context/get_jwt_token_example.py","The provided code is an asynchronous Python script that facilitates authentication with Firebase using GitHub's Device Flow. It imports necessary modules and defines constants for the Firebase API key, GitHub client ID, and application name. The main function initiates the authentication process, attempting to retrieve a Firebase ID token through the `get_jwt_token` function. It handles various exceptions, including authentication errors, network issues, token errors, and rate limits, providing user-friendly messages for each case. Upon successful authentication, the script updates a `.env` file with the new JWT token, ensuring that the token is either replaced if it already exists or added if it does not. The script is designed to be run as a standalone application, utilizing the asyncio library to manage asynchronous operations.",2025-02-09T07:17:13.397627+00:00
"context/get_language_example.py","This Python script demonstrates the usage of a 'get_language' function that determines the programming language associated with a file extension. The code consists of a main function that serves as an example implementation. Inside the main function, it defines a sample file extension '.py' and attempts to get the corresponding programming language using the imported get_language function. The code includes error handling through a try-except block to catch any potential exceptions during execution. If a language is successfully identified, it prints the file extension and its associated programming language. If no language is found, it displays a message indicating that no programming language was found for the given extension. The script uses type hints for better code readability and follows Python's standard if __name__ == '__main__' pattern for script execution. The code is well-structured and includes proper documentation through docstrings.",2024-12-07T01:53:09.050133+00:00
"context/git_update_example.py","This Python script demonstrates the usage of a 'git_update' function from the 'pdd.git_update' module. The script loads an input prompt from a file named 'prompts/fix_error_loop_python.prompt', then passes it along with a target code file path ('pdd/fix_error_loop.py') to the git_update function. Additional parameters include strength (0.97) and temperature (0) for the language model. Upon successful execution, the script prints the modified prompt, the cost of the operation, and the model name used. It then saves the updated prompt back to the original file. The script includes error handling for both specific ValueError exceptions and generic errors. The function appears to be part of a system that uses language models to automatically update code based on text prompts, likely for automated code modification or generation purposes.",2025-04-05T08:29:48.283959+00:00
"context/increase_tests_example.py","This file demonstrates the usage of the 'increase_tests' function from the 'pdd.increase_tests' module. The code showcases how to generate additional unit tests to improve test coverage for existing code. The file contains an 'example_usage' function that illustrates both basic and advanced usage patterns. It sets up sample inputs including a simple function that calculates the average of a list of numbers, a basic unit test for this function, a coverage report showing 60% coverage, and the original prompt that generated the code. The example then calls 'increase_tests' twice: first with minimal required parameters and then with additional customization options including language specification, strength (0.97), temperature (0.0), and verbose output. The function captures and displays the generated tests, the cost of generating them, and the model used. The code includes error handling for both validation errors and unexpected exceptions. The file is designed to run the demonstration when executed directly as a script, serving as a practical example of how to leverage the test generation functionality.",2025-04-05T08:29:48.295833+00:00
"context/insert_includes_example.py","This Python file demonstrates the usage of an insert_includes module for processing dependencies. The main function, example_usage(), showcases how to set up and execute dependency processing with error handling. The code initializes a Rich console for formatted output and defines input parameters including a prompt for a Python function that handles CSV files, a directory path for example files, and a CSV filename for dependency information. The insert_includes function is called with specific parameters like strength and temperature to control the output. The code then displays the results including the original prompt, modified prompt with dependencies, CSV output, model name, and total cost. The processed CSV output is saved to a file. Error handling is implemented for common issues like missing files or processing errors. The code uses the Rich library for enhanced console output formatting and the pathlib library for file operations. This appears to be part of a larger system for managing and processing project dependencies with AI model integration.",2024-12-07T22:11:27.202537+00:00
"context/install_completion_example.py","This Python script serves as an example for installing shell completion for the PDD command-line interface (CLI). It demonstrates the use of functions from the pdd package, specifically `get_local_pdd_path()` to retrieve the absolute path to the PDD_PATH directory and `install_completion()` to set up shell completion. The script creates a controlled environment by setting dummy environment variables and generating necessary files without affecting the user's actual configuration. It forces the shell to bash, creates a dummy home directory, and a PDD_PATH directory, where it generates a sample completion script and a bash RC file. The main function orchestrates the setup and execution, providing feedback through the Rich library for better console output. The example concludes with instructions on how to run the script, ensuring users can replicate the setup safely.",2025-02-09T07:17:19.675230+00:00
"context/langchain_lcel_example.py","This Python file demonstrates comprehensive LangChain integration with various LLM providers and features. It showcases how to use multiple AI models including OpenAI, Google's Gemini, Claude, Azure OpenAI, Fireworks, Groq, Together.ai, Deepseek, and Ollama. The code illustrates modern LangChain Expression Language (LCEL) patterns using pipe operators for chain construction, structured output parsing with JSON and Pydantic models, custom callback handlers for tracking completion status and token usage, and caching mechanisms to improve performance. The file contains numerous examples of prompt templates, model configuration, fallback strategies, and specialized features like Claude's thinking tokens. Throughout the examples, a joke-generation use case demonstrates how different models handle the same prompt with various output formats and configurations.",2025-03-09T19:49:10.864511+00:00
