full_path,file_summary,key_exports,dependencies,content_hash
pin_example_hack.py,"Orchestrates the PDD sync workflow by coordinating code generation, testing, crash fixing, and verification operations with parallel TUI animation, budget tracking, atomic state updates, and cycle detection.","[""sync_orchestration"", ""AtomicStateUpdate"", ""PendingStateUpdate"", ""load_sync_log"", ""create_sync_log_entry"", ""update_sync_log_entry"", ""append_sync_log"", ""log_sync_event"", ""save_run_report"", ""MAX_CONSECUTIVE_TESTS"", ""MAX_TEST_EXTEND_ATTEMPTS"", ""MAX_CONSECUTIVE_CRASHES""]","[""threading"", ""time"", ""json"", ""datetime"", ""subprocess"", ""re"", ""os"", ""pathlib"", ""typing"", ""dataclasses"", ""tempfile"", ""sys"", ""click"", ""logging""]",8cee5904fe3807689ff6d6e8e55761f226eb94174c25c7af4bd521b5b32693f9
postprocess.py,Extracts code blocks from LLM text output using either simple regex parsing or an LLM-based structured extraction approach.,"[""ExtractedCode"", ""postprocess"", ""postprocess_0""]","[""re"", ""typing"", ""rich"", ""pydantic""]",8d2e931b415a1f8f2a49523b32822c77ab97b1cdd79a6ce0bb6f403f69369893
postprocess_0.py,Processes LLM output by identifying the largest code section for a given language and commenting out all lines outside it.,"[""postprocess_0""]","["".get_comment"", "".comment_line"", "".find_section""]",396d7b1b20852d812b0b25a1dad2f8b32ba1a37ab6c857f6c327a443804b74f3
preprocess.py,"Preprocesses prompt templates by resolving file includes (backtick, XML, include-many), executing shell commands, scraping web content, and escaping curly braces for PromptTemplate compatibility.","[""preprocess"", ""process_backtick_includes"", ""process_xml_tags"", ""process_include_tags"", ""process_include_many_tags"", ""process_pdd_tags"", ""process_shell_tags"", ""process_web_tags"", ""double_curly"", ""get_file_path""]","[""os"", ""re"", ""base64"", ""subprocess"", ""typing"", ""traceback"", ""pathlib"", ""rich"", ""pdd"", ""PIL"", ""pillow_heif"", ""firecrawl"", ""io"", ""warnings"", ""concurrent""]",1ad6645d671d2e82120977e552f61e279ca5b94ff91cc7d900d8a18a0f976b26
preprocess_main.py,"CLI wrapper that orchestrates prompt preprocessing, including optional XML tagging, PDD metadata injection, and output file saving.","[""preprocess_main""]","[""csv"", ""sys"", ""pathlib"", ""typing"", ""click"", ""rich""]",6a95bf2ffb3889a23f530555f745619427b83ef2438a377ce2473b1ebc79b656
process_csv_change.py,"Processes a CSV file of prompt-change instructions, resolves prompt and code file paths, and applies LLM-driven modifications with budget tracking.","[""resolve_prompt_path"", ""process_csv_change""]","[""csv"", ""os"", ""typing"", ""rich""]",3d2cba9a8d295658d32d8280e5052e0cbdbc23a4a64ca4b147af18b66e72d251
provider_manager.py,"Manages LLM provider configuration including CSV-based model registry, shell-aware API key storage, and interactive setup/removal of providers and credentials.","[""CSV_FIELDNAMES"", ""COMPLEX_AUTH_PROVIDERS"", ""parse_api_key_vars"", ""is_multi_credential"", ""add_provider_from_registry"", ""add_custom_provider"", ""remove_models_by_provider"", ""remove_individual_models"", ""console""]","[""csv"", ""io"", ""os"", ""re"", ""shlex"", ""shutil"", ""tempfile"", ""datetime"", ""pathlib"", ""typing"", ""rich""]",789a8216ee2fd4271e0f23ae61d7829711a260c5852cf2723685a264ceb59b21
pytest_output.py,"Runs pytest on specified test files via subprocess, captures and parses the output (pass/fail/error/warning counts), and optionally saves results as JSON.","[""run_pytest_and_capture_output"", ""save_output_to_json"", ""extract_failing_files_from_output"", ""TestResultCollector"", ""main""]","[""argparse"", ""json"", ""io"", ""re"", ""sys"", ""pytest"", ""subprocess"", ""pathlib"", ""rich"", ""os""]",b1ef53e8e80c7a08ab9e24c8121e5a11e44317257be2af9a704c5283fa247fba
python_env_detector.py,"Detects the host shell's Python environment (conda, venv, poetry, pipenv) and resolves the appropriate Python executable for subprocess calls.","[""detect_host_python_executable"", ""get_environment_info"", ""is_in_virtual_environment"", ""get_environment_type""]","[""os"", ""sys"", ""shutil"", ""pathlib"", ""typing""]",cbe4044a83cd88a683f36d6ecfca245fef6a03ea2abc7f5c407636fccc051f35
remote_session.py,"Manages remote PDD Connect sessions via cloud APIs, handling registration, heartbeats, command polling/execution, cancellation, and JWT token refresh.","[""RemoteSessionManager"", ""RemoteSessionError"", ""SessionInfo"", ""CommandInfo"", ""get_active_session_manager"", ""set_active_session_manager"", ""console""]","[""ast"", ""asyncio"", ""datetime"", ""platform"", ""socket"", ""sys"", ""dataclasses"", ""pathlib"", ""typing"", ""httpx"", ""rich""]",163292e0200246767f685e9478c8ab4531c06ba471be4ceb9a6ee8065b1cfc12
render_mermaid.py,Renders an architecture JSON file as a self-contained interactive HTML page with a color-coded Mermaid flowchart diagram and hover tooltips.,"[""generate_mermaid_code"", ""generate_html"", ""write_pretty_architecture_json"", ""INDENT"", ""LEVELS""]","[""json"", ""sys"", ""html"", ""pathlib""]",9ef14efd6979329608885df23294e817c78f7ab1ecaf773d595ef8e6ef98dd7f
server/__init__.py,"Package init that exposes the PDD server's public API, including app creation, job management, command execution, security, and websocket components.","[""create_app"", ""run_server"", ""execute_pdd_command"", ""Job"", ""JobManager"", ""ServerConfig"", ""ServerStatus"", ""ConnectionManager"", ""PathValidator"", ""SecurityError"", ""DEFAULT_HOST"", ""DEFAULT_PORT"", ""API_VERSION""]","[""__future__""]",8e83c199ca1766c89385734e0a1e33347a92f893f4032ee09a206ed3afc744bb
server/app.py,"Defines the FastAPI application factory, global application state, exception handlers, lifespan management, and server runner for a Prompt Driven Development (PDD) local REST server.","[""AppState"", ""create_app"", ""run_server"", ""get_app_state"", ""get_path_validator"", ""get_job_manager"", ""get_connection_manager"", ""get_server_port""]","[""asyncio"", ""contextlib"", ""datetime"", ""pathlib"", ""typing"", ""uvicorn"", ""fastapi"", ""rich""]",28394e19c9174f44cda9cf37b93229d74012bd2e61c49e0d03e665796be94279
server/click_executor.py,"Provides programmatic execution of Click CLI commands with isolated contexts, output capture, real-time streaming, and a lazy-loading command registry for PDD server.","[""CapturedOutput"", ""StreamingWriter"", ""OutputCapture"", ""create_isolated_context"", ""ClickCommandExecutor"", ""get_pdd_command"", ""INTEGER_OPTIONS"", ""FLOAT_OPTIONS"", ""BOOLEAN_OPTIONS""]","[""io"", ""os"", ""sys"", ""dataclasses"", ""typing"", ""unittest"", ""click""]",b8e1e120d050f0545f2c3979c94390b07431a30af391bfd30bc052770f11edda
server/executor.py,"Provides utilities for programmatically executing Click CLI commands with isolated contexts, output capture, real-time streaming, and error handling.","[""CapturedOutput"", ""StreamingWriter"", ""OutputCapture"", ""create_isolated_context"", ""ClickCommandExecutor"", ""get_pdd_command"", ""execute_pdd_command""]","[""io"", ""sys"", ""dataclasses"", ""typing"", ""unittest"", ""click"", ""rich""]",249504fc9a00609062d2f846af665225b051f455115dee0af626324a3a7b99a9
server/jobs.py,"Manages async job queuing, execution, cancellation, and lifecycle tracking for PDD CLI commands run as subprocesses with real-time output streaming.","[""JOB_TIMEOUT"", ""GLOBAL_OPTIONS"", ""POSITIONAL_ARGS"", ""MANUAL_MODE_FILE_KEYS"", ""Job"", ""JobCallbacks"", ""JobManager"", ""_build_subprocess_command_args"", ""_find_pdd_executable""]","[""asyncio"", ""logging"", ""os"", ""signal"", ""subprocess"", ""sys"", ""threading"", ""time"", ""concurrent"", ""dataclasses"", ""datetime"", ""pathlib"", ""typing"", ""uuid"", ""rich""]",9459f35b583e92ff7de783a42405e30583c3fe35ca14e41932212fba2a3f6fdc
server/models.py,"Defines Pydantic v2 models for a PDD Server REST API covering file operations, command/job management, WebSocket messaging, and server configuration.","[""FileMetadata"", ""FileTreeNode"", ""FileContent"", ""WriteFileRequest"", ""WriteResult"", ""CommandRequest"", ""JobHandle"", ""JobStatus"", ""JobResult"", ""WSMessage"", ""StdoutMessage"", ""StderrMessage"", ""ProgressMessage"", ""InputRequestMessage"", ""CompleteMessage""]","[""datetime"", ""enum"", ""typing"", ""pydantic""]",a17b2f09033b2fe7063f484a2efb59184f7cb2fba822ee25605a93bbe5905941
server/routes/__init__.py,"Package init that aggregates and re-exports API router modules for architecture, auth, config, extracts, files, commands, prompts, and websocket endpoints.","[""architecture"", ""auth"", ""config"", ""extracts"", ""files"", ""commands"", ""prompts"", ""architecture_router"", ""auth_router"", ""config_router"", ""extracts_router"", ""files_router"", ""commands_router"", ""websocket_router"", ""prompts_router""]","[""__future__""]",be18cbdee75cb9afd377e404b189be8f3e5a578d638af87a5edf137498a4aaa1
server/routes/architecture.py,"Defines FastAPI REST endpoints for validating architecture module dependencies, syncing architecture from prompt metadata, generating PDD tags, generating architecture from GitHub issues, and agentic graph layout rearrangement.","[""router"", ""ArchitectureModule"", ""ValidationError"", ""ValidationWarning"", ""ValidateArchitectureRequest"", ""ValidationResult"", ""SyncRequest"", ""SyncResult"", ""GenerateTagsRequest"", ""GenerateTagsResult"", ""GenerateFromIssueRequest"", ""GenerateFromIssueResult"", ""RearrangeRequest"", ""RearrangeResult""]","[""asyncio"", ""re"", ""json"", ""concurrent"", ""pathlib"", ""typing"", ""fastapi"", ""pydantic"", ""pdd""]",86b07e88dd7aeeb6683047cfc8b57b78ac480ada6e617f06b847c9f0a248e569
server/routes/auth.py,"Defines FastAPI authentication routes for checking auth status, logging out, initiating GitHub Device Flow login, polling login progress, and testing cloud connectivity.","[""router"", ""AuthStatus"", ""LogoutResult"", ""LoginRequest"", ""LoginResponse"", ""LoginPollResponse"", ""JWTTokenResponse"", ""CloudConnectionTestResponse"", ""get_auth_status"", ""get_jwt_token"", ""logout"", ""start_login"", ""poll_login_status"", ""test_cloud_connection""]","[""os"", ""time"", ""uuid"", ""webbrowser"", ""typing"", ""fastapi"", ""pydantic"", ""pdd""]",629e936f6fd2d96b55669cdb31bfcb9cbf93dbf08c859477007c46ce56a5ffc7
server/routes/commands.py,"Defines FastAPI REST endpoints for submitting, monitoring, canceling, and spawning PDD CLI commands via async job management and terminal subprocesses.","[""router"", ""RunResult"", ""CancelResult"", ""ProcessTracker"", ""SpawnTerminalResponse"", ""SpawnedJobCompleteRequest"", ""SpawnedJobCompleteResponse"", ""SpawnedJobStatus"", ""ALLOWED_COMMANDS"", ""POSITIONAL_ARGS"", ""GLOBAL_OPTIONS"", ""set_job_manager"", ""get_job_manager"", ""set_project_root"", ""get_project_root"", ""set_server_port""]","[""asyncio"", ""os"", ""signal"", ""subprocess"", ""sys"", ""threading"", ""time"", ""uuid"", ""datetime"", ""pathlib"", ""typing"", ""fastapi"", ""rich"", ""pydantic""]",c70fd869490688b3a9b0ea39cdddf301f93abdcfd364c4d722232a6dc820c0f2
server/routes/config.py,Defines a FastAPI route that exposes the server's cloud URL and environment configuration to frontend clients.,"[""router"", ""CloudUrlResponse"", ""get_cloud_url""]","[""fastapi"", ""pydantic"", ""pdd""]",efe80f308a6a2acdb6a207288f746d39f0947da597c44c358595ff7b70e587d9
server/routes/extracts.py,"Defines FastAPI REST endpoints for listing, inspecting, freshness-checking, and pruning cached LLM extraction results stored in .pdd/extracts/.","[""router"", ""ExtractMetadata"", ""ExtractContent"", ""ExtractListResponse"", ""PromptExtractInfo"", ""PruneResponse"", ""get_project_root"", ""set_project_root"", ""list_extracts"", ""extracts_for_prompt"", ""prune_extracts"", ""get_extract""]","[""hashlib"", ""json"", ""os"", ""re"", ""datetime"", ""pathlib"", ""typing"", ""fastapi"", ""pydantic"", ""rich""]",1308d4b7c79d5560e31d25c60820405c1e5f3ef2560eb03674f0fb4e9cf03794
server/routes/files.py,"Defines FastAPI REST API endpoints for browsing file trees, reading/writing file content, listing and detecting changed prompt files, and retrieving file metadata with security validation.","[""router"", ""get_path_validator"", ""set_path_validator"", ""BINARY_EXTENSIONS"", ""DEFAULT_CHUNK_SIZE"", ""KNOWN_LANGUAGES"", ""LANGUAGE_EXTENSIONS"", ""load_pddrc"", ""match_context"", ""parse_prompt_stem"", ""get_file_tree"", ""get_file_content"", ""write_file"", ""list_prompt_files"", ""list_changed_prompt_files""]","[""base64"", ""hashlib"", ""datetime"", ""pathlib"", ""typing"", ""fastapi"", ""rich""]",ae18eb66ee106fa28668d392fc4b599fd00b28c1ae46f2c5c54deb9b88ae97c0
server/routes/prompts.py,"Defines FastAPI REST endpoints and Pydantic models for prompt analysis, token metrics, sync status, model listing, match checking, diff analysis, and git-based prompt version history.","[""router"", ""CostEstimateResponse"", ""TokenMetricsResponse"", ""PromptAnalyzeRequest"", ""PromptAnalyzeResponse"", ""SyncStatusResponse"", ""ModelInfo"", ""ModelsResponse"", ""MatchCheckRequest"", ""MatchCheckResponse"", ""DiffAnalysisRequest"", ""DiffAnalysisResponse"", ""PromptDiffRequest"", ""PromptDiffResponse"", ""set_path_validator""]","[""os"", ""pathlib"", ""typing"", ""fastapi"", ""pydantic"", ""rich"", ""pdd""]",7636536d90533e1ccac0703c9283304702b4167b6eedbc23d7656e9105f886ad
server/routes/websocket.py,"Provides WebSocket endpoints and a connection manager for streaming job output, handling user input/cancellation, and broadcasting file system change events via FastAPI.","[""router"", ""ConnectionManager"", ""manager"", ""AsyncFileEventHandler"", ""clean_ansi"", ""emit_job_output"", ""emit_job_progress"", ""emit_job_complete"", ""emit_spawned_job_complete"", ""create_websocket_routes"", ""ANSI_ESCAPE"", ""DEBOUNCE_SECONDS""]","[""asyncio"", ""json"", ""re"", ""time"", ""datetime"", ""pathlib"", ""typing"", ""fastapi"", ""rich"", ""watchdog""]",961fbae5ff5944b4be4104be65320c8bfb3bda62bff4db6eeaf4df8b1da1039a
server/security.py,"Provides security utilities for a FastAPI application, including path validation with blacklisting, CORS configuration, Bearer token authentication, and request logging middleware.","[""DEFAULT_BLACKLIST"", ""SecurityError"", ""PathValidator"", ""configure_cors"", ""create_token_dependency"", ""SecurityLoggingMiddleware""]","[""fnmatch"", ""time"", ""pathlib"", ""typing"", ""fastapi"", ""starlette"", ""rich""]",5e64f8aa746d9642f428c59366ecf1c743d0fd77606ac60b5d8187da8737358e
server/terminal_spawner.py,"Provides cross-platform terminal window spawning with command execution and optional server callback for job completion tracking on macOS, Linux, and Windows.","[""TerminalSpawner"", ""DEFAULT_SERVER_PORT""]","[""os"", ""shutil"", ""subprocess"", ""sys"", ""pathlib"", ""typing""]",efffd485569bb2f2e673b408c607a02a9b3325f46d2db8af2f4f8f8439f49fb5
server/token_counter.py,"Provides token counting, context window lookup, and cost estimation utilities using litellm with tiktoken as a fallback.","[""CostEstimate"", ""TokenMetrics"", ""count_tokens"", ""get_context_limit"", ""estimate_cost"", ""get_token_metrics""]","[""csv"", ""dataclasses"", ""functools"", ""pathlib"", ""typing"", ""litellm"", ""tiktoken""]",c94fce0132ef534f63d08f4763e801825ba0b15d595987e8535f1a9bb5d75f6b
setup_tool.py,"Orchestrates the interactive `pdd setup` command through a two-phase flow: CLI bootstrap with user prompts, then deterministic auto-configuration of API keys, models, and project files.","[""run_setup""]","[""getpass"", ""os"", ""sys"", ""pathlib"", ""typing"", ""rich"", ""pdd""]",d00d304fd60bdab90275b6699040a718d94d820808d1b4b21047537f1d454a2a
split.py,Splits a prompt into extracted sub-module functionality and a remaining prompt using two sequential LLM invocations with structured Pydantic output.,"[""PromptSplit"", ""split""]","[""typing"", ""rich"", ""pydantic""]",f655ab87e24e8cea71469e3eb3554bedba893155a5b266392f138d4fbb1833c0
split_main.py,"CLI wrapper that orchestrates splitting a prompt into extracted functionality and remaining prompt, handling file I/O, error reporting, and user feedback.","[""split_main""]","[""sys"", ""typing"", ""click"", ""rich""]",e76adc668792ff0a58462a9ba8c520aff85463b192eb6a2dc330dfb801a2e980
summarize_directory.py,"Summarizes all files in a directory using an LLM, with content-hash-based caching and CSV output for incremental progress.","[""summarize_directory"", ""FileSummary"", ""BINARY_EXTENSIONS""]","[""glob"", ""hashlib"", ""io"", ""csv"", ""os"", ""subprocess"", ""json"", ""typing"", ""pydantic"", ""rich""]",3fd0f28a8f42eaa60973698b737fba46774a6105b6b8b7afe5c8e4224a0696bb
sync_animation.py,"Renders an animated terminal UI showing an org-chart-style diagram of PDD workflow boxes (Prompt, Code, Example, Tests) with connecting arrows, scrolling paths, cost tracking, and blinking emojis using Rich.","[""AnimationState"", ""sync_animation"", ""EMOJIS"", ""PDD_LOGO_ASCII"", ""CONSOLE_WIDTH"", ""ANIMATION_BOX_HEIGHT"", ""DEEP_NAVY"", ""ELECTRIC_CYAN"", ""LUMEN_PURPLE"", ""PROMPT_MAGENTA"", ""BUILD_GREEN""]","[""time"", ""os"", ""datetime"", ""threading"", ""typing"", ""rich""]",e60160f06f0f28cb492e449c395f7c3800f24212cc9f0eab25fd29a99c408906
sync_determine_operation.py,"Implements fingerprint-based state analysis and deterministic operation selection for the PDD sync command, deciding which workflow step (generate, test, fix, etc.) to run next.","[""sync_determine_operation"", ""analyze_conflict_with_llm"", ""read_run_report"", ""get_pdd_file_paths"", ""Fingerprint"", ""RunReport"", ""SyncDecision"", ""SyncLock"", ""PDD_DIR"", ""META_DIR"", ""LOCKS_DIR"", ""get_pdd_dir"", ""get_meta_dir"", ""get_locks_dir"", ""calculate_sha256""]","[""os"", ""re"", ""sys"", ""json"", ""hashlib"", ""subprocess"", ""fnmatch"", ""pathlib"", ""dataclasses"", ""typing"", ""datetime"", ""psutil"", ""pdd"", ""logging""]",da10acc6a41c72f0afcb2d6137d78bd912c5feb18fe80e41895559de06139f55
sync_main.py,"Implements the main CLI sync workflow for PDD, handling basename validation, multi-language prompt discovery, path resolution, budget tracking, and orchestration of code synchronization across detected languages.","[""sync_main"", ""SUPPORTED_SYNC_LANGUAGES"", ""VALID_BASENAME_CHARS"", ""_validate_basename"", ""_detect_languages"", ""_detect_languages_with_context"", ""_find_prompt_in_contexts"", ""_normalize_prompts_root"", ""_python_first_sorted"", ""_extract_prompts_base_dir"", ""_relative_basename_for_context""]","[""fnmatch"", ""re"", ""time"", ""pathlib"", ""typing"", ""click"", ""rich""]",4beb957bbebb1f3256988c51e3df723d05d74bb6e0cff80b906fe6ed25d69aef
sync_orchestration.py,"Orchestrates the PDD sync workflow by coordinating code generation, testing, crash detection, fixing, and verification operations with parallel TUI animation and atomic state management.","[""sync_orchestration"", ""AtomicStateUpdate"", ""PendingStateUpdate"", ""MAX_CONSECUTIVE_TESTS"", ""MAX_TEST_EXTEND_ATTEMPTS"", ""MAX_CONSECUTIVE_CRASHES""]","[""threading"", ""time"", ""json"", ""datetime"", ""subprocess"", ""re"", ""os"", ""pathlib"", ""typing"", ""dataclasses"", ""tempfile"", ""sys"", ""click"", ""logging""]",6a24a89af727bcd12d94896d38a05baed7fbe155d0cd7c2d266dc87decc6d22a
sync_order.py,"Builds a dependency graph from prompt file includes, performs topological sorting, identifies affected modules, and generates ordered sync shell scripts.","[""extract_includes_from_file"", ""extract_module_from_include"", ""build_dependency_graph"", ""topological_sort"", ""get_affected_modules"", ""generate_sync_order_script""]","[""os"", ""re"", ""stat"", ""logging"", ""datetime"", ""pathlib"", ""typing"", ""collections"", ""rich"", ""pdd""]",97c131ddb0d085eaeb68b8ccfc5e674c1027f40d71639be03417a92d2508bc70
sync_tui.py,"Provides a Textual-based terminal UI for PDD sync operations, including animated displays, modal dialogs for confirmation/input/choice, stdout/stdin redirection, and user steering of sync workflows.","[""SyncApp"", ""ChoiceScreen"", ""ConfirmScreen"", ""InputScreen"", ""ThreadSafeRedirector"", ""TUIStdoutWrapper"", ""TUIStdinRedirector"", ""show_exit_animation"", ""maybe_steer_operation"", ""DEFAULT_STEER_TIMEOUT_S""]","[""threading"", ""sys"", ""os"", ""typing"", ""io"", ""asyncio"", ""textual"", ""rich"", ""time"", ""re""]",ee30cc819ab17b744224126564010e22e4d179f3e5dcedf056f591822cd03ca9
template_expander.py,"Expands path templates with placeholders like {name}, {category}, and {ext}, supporting case conversions (snake, pascal, kebab) and path normalization.","[""expand_template""]","[""re"", ""os"", ""typing""]",bcaa670f334b9fa7726aa85906e70125ad2cd4b7e7b62a8e39f8bdd06c975edb
template_registry.py,"Discovers, indexes, and manages prompt templates from packaged and project sources, supporting listing, loading, inspecting, and copying operations with YAML front-matter metadata parsing.","[""TemplateMeta"", ""list_templates"", ""load_template"", ""show_template"", ""copy_template""]","[""re"", ""shutil"", ""collections"", ""dataclasses"", ""pathlib"", ""typing"", ""importlib""]",2fc650f9aa667437bb263fc99601efedf528222267183b84d15eb863e30ef6f0
trace.py,Traces a line of generated code back to its originating line in a prompt file using LLM analysis and fuzzy string matching.,"[""trace"", ""PromptLineOutput""]","[""typing"", ""rich"", ""pydantic"", ""difflib"", ""re""]",9ff879812f1def2c14995b939a3b6541590ee68a7f62b25e57064ac7d642fbcb
trace_main.py,"Implements the core logic for the CLI 'trace' command, which traces a code line back to its originating prompt line and optionally saves results.","[""trace_main""]","[""click"", ""rich"", ""typing"", ""os"", ""logging""]",48e9cc107b5af5668c031ba532b93a685a2399ae2d8bad482ef269dcd561a5b8
track_cost.py,"Provides a decorator that tracks CLI command costs, collects input/output file paths, and logs execution metadata to a CSV file.","[""track_cost"", ""extract_cost_and_model"", ""collect_files""]","[""functools"", ""datetime"", ""csv"", ""os"", ""click"", ""rich"", ""typing""]",63ad7826cd7b69f85d717c38ea1f019714625e63c3725ddf3a63f99ba588d4c6
unfinished_prompt.py,"Analyzes whether a given prompt text is complete or truncated/unfinished, using both fast Python syntax checks and LLM-based assessment.","[""PromptAnalysis"", ""unfinished_prompt""]","[""typing"", ""ast"", ""textwrap"", ""warnings"", ""pydantic"", ""rich""]",b012d1c6fab0579ae674d2d6e26be119dd9288c7ba2741b75af516be7a4564bf
update_main.py,"Provides CLI logic for updating prompt files from code changes, supporting single-file updates, repository-wide scans with drift detection, dependency ordering, architecture/PRD sync, and agentic or legacy LLM pipelines.","[""resolve_prompt_code_pair"", ""find_and_resolve_all_pairs"", ""get_git_changed_files"", ""derive_basename_and_language"", ""is_code_changed"", ""update_file_pair"", ""update_main""]","[""fnmatch"", ""re"", ""subprocess"", ""sys"", ""heapq"", ""collections"", ""typing"", ""click"", ""rich"", ""os"", ""pathlib"", ""git""]",d82676d754e4fe5c0b1282c9482779ee84a11016ca14ffb4d211bc83533c9305
update_model_costs.py,"CLI script that reads an LLM model CSV file and updates missing cost and structured output data using LiteLLM, with rich console reporting.","[""update_model_data"", ""main"", ""EXPECTED_COLUMNS"", ""INT_COLUMNS""]","[""argparse"", ""os"", ""pandas"", ""litellm"", ""rich"", ""math"", ""pathlib""]",45f78e9401ed735142c78ec0ec28eb1f6b7959741c950ffdb98b4d8ed421ef92
update_prompt.py,Updates an LLM prompt based on differences between original and modified code using a two-step LLM invocation pipeline.,"[""PromptUpdate"", ""update_prompt""]","[""typing"", ""rich"", ""pydantic""]",2b58bd048a5bde2a0518cdf659caae780b8aab32e57b3b0fb2f728bce6a03a12
user_story_tests.py,"Manages user story lifecycle including discovery, prompt linking via metadata, story generation from prompt files, story-based test validation, and automated prompt fixing.","[""DEFAULT_STORIES_DIR"", ""DEFAULT_PROMPTS_DIR"", ""DEFAULT_SRC_DIR"", ""STORY_PREFIX"", ""STORY_SUFFIX"", ""STORY_PROMPTS_METADATA_KEY"", ""discover_story_files"", ""discover_prompt_files"", ""cache_story_prompt_links"", ""generate_user_story"", ""run_user_story_tests"", ""run_user_story_fix""]","[""logging"", ""os"", ""re"", ""pathlib"", ""typing"", ""rich""]",04f84ddc72d9ce597c9c8f87cfcbaf9496c5cb03f72d6042a8fd334972ce20c5
xml_tagger.py,Enhances LLM prompts by adding XML tags for improved structure and readability using a two-step LLM invocation pipeline.,"[""XMLOutput"", ""xml_tagger"", ""main""]","[""typing"", ""rich"", ""pydantic""]",e417371d19bb8b3fd78c177340870c6fc2a871443c3c42c8d8d3791b0e1a99de
