full_path,file_summary,key_exports,dependencies,content_hash
context/metadata_sync_example.py,A demonstration script showing how to use the `run_metadata_sync` function from the `pdd.metadata_sync` module in a simulated dry-run environment.,"[""PROMPT_CONTENT"", ""main""]","[""os"", ""sys"", ""tempfile"", ""pathlib"", ""pdd""]",704453b3386724eef225b61c48f2fe922e1a973ac211c494e1d955dd44bcca11
context/model_tester_example.py,"Demonstrates interactive LLM model testing by listing configured models, testing connectivity, and displaying diagnostics.","[""main""]","[""sys"", ""pathlib"", ""pdd""]",9d33f093cdac4c100bf671e891a68c7f83e2e09e74cd65f6b53cb567d77d3cd0
context/one_session_sync_example.py,"Demonstrates usage of the one-session PDD sync workflow with mocked dependencies, showcasing prompt building, sync execution, and progress tracking.",[],"[""sys"", ""pathlib"", ""unittest""]",f2260e5e7b558e0cf1b0cb26acb7c95072c5ffd17d19231a2455979e7d8b9556
context/operation_log_example.py,"Demonstrates usage of the pdd.operation_log module for tracking PDD operations, including logging, fingerprinting, run reports, and the @log_operation decorator.","[""demonstrate_log_operations"", ""demonstrate_module_identity"", ""demonstrate_state_management"", ""generate"", ""fix""]","[""click"", ""pathlib"", ""typing"", ""pdd""]",6cd7962ab255d6080aeb97897175250f987ce936cf7333e7601f10834405a940
context/path_resolution_example.py,"A CLI script that demonstrates resolving various PDD resource paths (includes, prompt templates, project root, and data files) using the default resolver.","[""main""]","[""pdd""]",15ba84fd11c61af8fa12dcb19d63d42f0cb09b747542bf20e69650b8ff4ac137
context/pdd_completion_example.fish,An example fish shell script for loading and applying command-line completions for the pdd command from a local source checkout.,[],[],005c0377d8bb3615d756b87d386846467056dcac0de08e6ad8be891f88831dc3
context/pdd_completion_example.sh,A bash script that loads and verifies the PDD bash completion function from a source checkout.,[],[],5dd4b32daff86b758df993ede39fa0122fb1a2a63e8d1b1b4c319eab24cdaa05
context/pdd_completion_example.zsh,A Zsh script that locates and sources the PDD completion file from the repository root to enable command-line tab completion.,[],[],86a65c7f77568e0ba1bc8652903a1609d7d0d1a20e8cd71c7d217d80a68943ca
context/pddrc_initializer_example.py,Demonstrates usage of the pddrc_initializer module for detecting project language and building .pddrc configuration content.,"[""main""]","[""sys"", ""pathlib"", ""pdd""]",3ba502fa9e2a2f438aaa890f0b654a98e5b8665253e10446acafda90f7eedad9
context/pin_example_hack_example.py,Demonstrates how to use the test execution helper from pdd.pin_example_hack by mocking the subprocess runner.,"[""example_execute_tests_with_mocked_runner""]","[""pathlib"", ""unittest"", ""pdd""]",34e285dedea6ad0d3f3a5539401cc7c0bf5b2181d954915963fd66cd86e54e3c
context/postprocess_0_example.py,Example script demonstrating usage of the `postprocess_0` function to extract and isolate the largest code block of a specified language from LLM output.,[],"[""pdd""]",2ff3f65a972fbd46519fefbb1467687c4d9f2b269e14e3810eb1a8427b1b396e
context/postprocess_example.py,Example script demonstrating simple and LLM-based code extraction using the `pdd.postprocess` module with mocked dependencies.,"[""main""]","[""rich"", ""unittest"", ""pdd""]",b98362e6ffb84ae7826dad27d0854e30706f3993266314439859986b32ecd0bd
context/preprocess_example.py,"Demonstrates the usage of the pdd.preprocess module to prepare LLM prompts with file inclusions, specific code extraction, shell command execution, and template escaping.","[""main""]","[""os"", ""sys"", ""pathlib"", ""rich"", ""pdd""]",d31a6ae815fd1276c36d58650060f19c0e1cad0d895c000713400d373e7a347a
context/preprocess_main_example.py,"CLI entry point that wraps the `preprocess_main` function with Click options for prompt preprocessing, XML tagging, bracket doubling, and PDD metadata injection.","[""cli""]","[""click"", ""pathlib"", ""pdd""]",dc4cf0483361ef94467d8936ceef30b54b62e61d658c916663407a8f142ec851
context/process_csv_change_example.py,"Demonstrates usage of `process_csv_change` by creating a small workspace with source code, a prompt file, and a CSV of instructions, then calling the function and printing results.",[],"[""pathlib"", ""pprint"", ""pdd""]",c7cf31cd55d5312b5398d3d518eddd33354fa184d0e92c6cf926a3c71d018227
context/provider_manager_example.py,"Demonstrates usage of the provider_manager module for adding, removing, and configuring LLM providers and their models.","[""main""]","[""sys"", ""pathlib"", ""pdd""]",cc2bbe6cefff4ad24af4365b0c4bc2c99e672f825d12edaca7307de9c04ecfb8
context/pytest_example.py,"Runs pytest programmatically, collecting test failures, errors, warnings, and captured logs via a custom plugin.","[""TestResultCollector"", ""run_pytest""]","[""pytest"", ""io"", ""sys"", ""os""]",f13c02d911d386ac5bab8e3d4aae64a768e4a7e960803c80fcac14e9ba5975cb
context/pytest_isolation_example.py,Provides reference implementations of correct test isolation patterns using pytest to prevent test pollution and ensure test independence.,"[""test_set_env_var_with_monkeypatch"", ""test_delete_env_var_with_monkeypatch"", ""test_multiple_env_vars"", ""test_mock_function_with_monkeypatch"", ""test_mock_with_context_manager"", ""test_create_temp_file"", ""test_create_temp_directory_structure"", ""resource_with_cleanup"", ""mock_module_with_cleanup"", ""test_combined_env_and_file"", ""captured_streams"", ""restore_streams_after_test"", ""test_exception_with_context_manager""]","[""os"", ""sys"", ""pathlib"", ""unittest"", ""pytest"", ""io""]",c5b726f330c9d105978d51affffd38849f9685cde739816beded2bd34a1aba39
context/pytest_output_example.py,"Demonstrates usage of the pytest_output module through multiple examples including running tests, capturing output, handling errors, and using TestResultCollector directly.","[""create_dummy_test_file"", ""main_example""]","[""argparse"", ""json"", ""io"", ""sys"", ""pytest"", ""rich"", ""os"", ""pdd""]",6f0cd68e3c4440081267c716651caec4fbdd7d9c4516f967517f02ae2a853920
context/python_env_detector_example.py,"Demonstrates usage of the python_env_detector module by detecting the host Python executable, virtual environment status, and detailed environment info.","[""main""]","[""pdd""]",65619b3e8bad0509f1ccf54d81b5c3760f423b6fc1925c932fc7968da78a172e
context/range_validator_example.py,"Demonstrates usage of the range_validator module, showcasing range checking, normalization, wrapping, and quantization functions.",[],"[""sys"", ""os"", ""range_validator""]",ff9ea438b40abece583b8182d77340ccb0e45318a50374b187a4e2dbdaaf929c
context/remote_session_example.py,"Example script demonstrating usage of the PDD RemoteSessionManager for registering, listing, heartbeating, and deregistering remote development sessions with mocked cloud endpoints.",[],"[""asyncio"", ""os"", ""sys"", ""pathlib"", ""unittest"", ""pdd"", ""httpx""]",ebcf3626cc73386164ac48e804e2e7973cb9783892ac88cda49779cf158389c5
context/render_mermaid_example.py,Demonstrates how to use the render_mermaid module to convert architecture.json files into interactive HTML Mermaid diagrams.,"[""create_sample_architecture"", ""example_basic_usage"", ""example_programmatic_usage"", ""example_with_real_architecture_file"", ""example_customization"", ""main""]","[""json"", ""sys"", ""os"", ""pathlib"", ""pdd""]",193a57bc4191595f252881c016ba7168c27c27c01ff192128d98cf76ce5f842b
context/resolve_effective_config_example.py,"Demonstrates example usage of resolve_effective_config for resolving strength, temperature, and time settings with CLI, pddrc, and default priority.",[],"[""pdd""]",8bb73c48821e07f533909f368d5cc1e029b12690830ceb9918c4f1bd7611a293
context/server/__init___example.py,"Demonstrates example usage of the PDD Server package including security validation, job management, and server interaction.","[""main"", ""demo_security_validation"", ""demo_job_manager"", ""demo_server_interaction""]","[""asyncio"", ""threading"", ""time"", ""requests"", ""pathlib"", ""rich"", ""pdd"", ""shutil"", ""sys""]",8817e0d29e93b3b67a7fe8fb08962ea8df850bbceda7390bbc12d42afd5070b8
context/server/app_example.py,"Demonstrates starting the PDD server in a background thread and interacting with its API endpoints for status, security, and documentation.",[],"[""sys"", ""asyncio"", ""threading"", ""time"", ""requests"", ""pathlib"", ""rich"", ""pdd"", ""shutil""]",554bb0307f2f7a0dc79ef86f8a4fd42e5017225d0c56379ad99d2939f3c1087a
context/server/click_executor_example.py,"Demonstrates usage of the ClickCommandExecutor module including basic execution, streaming output, error handling, and context passing.","[""greet"", ""fail_command"", ""demo_basic_execution"", ""demo_streaming_execution"", ""demo_error_handling"", ""demo_context_passing""]","[""sys"", ""time"", ""click"", ""typing"", ""click_executor""]",a61ee766f5b09bfa0de58533125b85d8855186f17f3109101887177a87d8d5c9
context/server/executor_example.py,Demonstrates usage of ClickCommandExecutor and execute_pdd_command for programmatically invoking Click commands with streaming output and captured results.,"[""greet_command"", ""on_output"", ""demo_executor_class"", ""demo_high_level_helper""]","[""sys"", ""click"", ""typing"", ""rich"", ""pdd""]",fb5d8d40aeeb2bf401dc6a84a43bee6936ee1e734b2b00bd08e7fbc44219a9cf
context/server/jobs_example.py,"Demonstrates the PDD JobManager's queuing, concurrency limiting, cancellation, and lifecycle callback features using a mock async worker.",[],"[""asyncio"", ""sys"", ""os"", ""logging"", ""datetime"", ""pdd""]",7694bd486d012fd9d52543c5f79a289f61dac3ed0f8c94c2ea9fd25ed6333f12
context/server/models_example.py,"Demonstrates usage of PDD server Pydantic models including validation, serialization, and WebSocket message handling through example scenarios.","[""example_usage""]","[""json"", ""datetime"", ""pydantic"", ""pdd""]",223a832718e72ca6640728e4bd700da58edb89667931085d7d949774d8fbc228
context/server/routes/__init___example.py,Example script demonstrating how to compose FastAPI routers from the pdd.server.routes package into a runnable application.,"[""create_app"", ""main""]","[""uvicorn"", ""fastapi""]",a8bed7e09c6cd96bf68bff186993dc56d32f106fee86ca14f7324285d44f2267
context/server/routes/architecture_example.py,Demonstrates and tests the architecture validation module via direct function calls and FastAPI HTTP endpoint usage.,"[""create_app"", ""demonstrate_direct_validation"", ""demonstrate_api_usage""]","[""asyncio"", ""uvicorn"", ""fastapi"", ""architecture""]",6adddc3703c575ef7eaa12c58df0067e438c2fe328e5037fb69856595e862bf8
context/server/routes/auth_example.py,Test/example script that mocks dependencies and demonstrates a GitHub Device Flow authentication lifecycle using a FastAPI TestClient.,"[""run_example_flow""]","[""asyncio"", ""os"", ""sys"", ""unittest"", ""fastapi"", ""importlib""]",8d6c5e1e858f07440184c0ae1b7f98ffa53a57233031513fa6566131404ceab5
context/server/routes/commands_example.py,"Demonstrates a self-contained FastAPI commands API with mock job management, async job execution, and a TestClient-based usage example.","[""JobStatus"", ""CommandRequest"", ""JobHandle"", ""JobResult"", ""MockJob"", ""MockJobManager"", ""router"", ""get_job_manager"", ""set_job_manager"", ""ALLOWED_COMMANDS"", ""execute_command"", ""get_job_status"", ""create_app"", ""run_example""]","[""asyncio"", ""uvicorn"", ""fastapi"", ""datetime"", ""typing"", ""dataclasses"", ""uuid"", ""enum"", ""pydantic"", ""sys"", ""types""]",2aee960b3f00528d1da6cd878806b82a9ea703827d66a8618d1899d6ea9076ea
context/server/routes/config_example.py,Defines a FastAPI router with a REST endpoint for exposing the server's cloud URL configuration to the frontend.,"[""router"", ""CloudUrlResponse"", ""get_cloud_url""]","[""fastapi"", ""pydantic""]",58f2b27cdf85200a52fbe76324d02431dc62f339afd3896de37c0fe759f55cde
context/server/routes/extracts_example.py,"Demonstrates mounting and interacting with the extracts FastAPI router, exercising all three endpoints with a mock project environment.",[],"[""asyncio"", ""json"", ""hashlib"", ""os"", ""tempfile"", ""pathlib"", ""sys"", ""fastapi"", ""httpx"", ""pdd""]",41070c16e3eca0acdf3b0877a08143df0d48b3fbd06db022fb7e1e883574688e
context/server/routes/files_example.py,"Implements a FastAPI file server with endpoints for browsing file trees, reading file content, and writing files, using mock security and models.","[""FileTreeNode"", ""FileContent"", ""WriteFileRequest"", ""WriteResult"", ""FileMetadata"", ""SecurityError"", ""PathValidator"", ""router"", ""get_tree"", ""get_content"", ""write_file"", ""main""]","[""uvicorn"", ""shutil"", ""os"", ""pathlib"", ""datetime"", ""typing"", ""fastapi"", ""pydantic"", ""base64"", ""hashlib""]",9e5d8e77e1d0238394c331a872fcb31e4597100fc9427d8bba7ee3550df4323d
context/server/routes/prompts_example.py,"Demonstrates and tests the PDD prompt analysis API route by mocking dependencies, setting up a FastAPI test client, and exercising endpoint examples.","[""create_example_app"", ""run_examples"", ""MockCostEstimate"", ""MockTokenMetrics"", ""mock_get_token_metrics"", ""mock_preprocess""]","[""sys"", ""os"", ""pathlib"", ""unittest"", ""fastapi""]",0c143874f91ca038a84580bd829fccf6adbe8bedfd33517089cc2bee6b7a04e1
context/server/routes/session_example.py,Defines a FastAPI router with a REST endpoint to query the server's remote session registration status with PDD Cloud.,"[""router"", ""RemoteSessionInfo"", ""get_session_info""]","[""datetime"", ""typing"", ""fastapi"", ""pydantic""]",7afec7e9141ead74f2ba74ac5a70a7f35793eb3409606539c81cf1e7b34ed1a9
context/server/routes/websocket_example.py,"Demonstrates WebSocket route usage for real-time job output streaming, file system change monitoring, connection management, and error handling with mock dependencies.","[""MockJobManager"", ""MockJob"", ""WebSocketClient"", ""example_job_streaming"", ""example_file_watching"", ""example_connection_management"", ""example_error_handling"", ""main""]","[""asyncio"", ""json"", ""tempfile"", ""time"", ""pathlib"", ""typing"", ""fastapi"", ""sys"", ""pdd""]",a4c2313449f3174039edf4ab1f2030247b4da0eb31e6411b1008516be95eb3cf
context/server/security_example.py,"Example FastAPI server demonstrating secure file access with token authentication, CORS configuration, path validation, and directory traversal prevention.","[""app""]","[""uvicorn"", ""pathlib"", ""fastapi"", ""pdd""]",dc4f3dc06455ba6180f4536aa67ce4e9a5efd52e0e9cd7702c3f2ec6ef96aac9
context/server/terminal_spawner_example.py,"Example script demonstrating how to use TerminalSpawner to spawn terminal windows with commands, working directories, and job tracking.",[],"[""os"", ""sys"", ""time"", ""pathlib"", ""pdd""]",de89761e9228d058064a52ed3bf4d84f2ceba1991e5b8e0a45a4af8f0c477e19
context/server/token_counter_example.py,"Demonstrates the token_counter module's API for counting tokens, checking context limits, estimating costs, and retrieving comprehensive token metrics.","[""create_dummy_pricing_csv"", ""main""]","[""csv"", ""json"", ""pathlib"", ""sys"", ""token_counter""]",75a40b397db75482e743fc7ec0ec26ae09650746111abb48a941e8d58214c9a5
context/setup_example.py,"Provides an example script to verify the installation, CLI entry points, and bundled data configuration for the pdd-cli package.","[""run_pdd_setup_example""]","[""os"", ""sys"", ""subprocess"", ""pdd""]",8e62b4f3ea9f5a7751f0000d38336dc9a4656ae97935e1501bb4123345a80511
context/setup_tool_example.py,Demonstrates usage of the pdd setup_tool module to launch the two-phase CLI bootstrap and configuration flow.,"[""main""]","[""sys"", ""pathlib"", ""pdd""]",83e9150eb35b3240a1b28083e3f195ad2bddd6f8019bccb2d4b9e1495451e0eb
context/split/simple_math/split_example.py,Script that demonstrates usage of the split_script module by calling its add function with valid and invalid arguments.,[],"[""split_script""]",68347c89811c07ed8503dd519f44e6ddd88e0c937829b865180c94664dbcd701
context/split_example.py,"Demonstrates usage of the pdd.split function by splitting a sample prompt and code, then printing the results.","[""main""]","[""os"", ""rich"", ""pdd""]",c36a6c3e5ddac660ef95d72dabc89f5453a3ebcd47f5f82ddc5fec77806154d9
context/split_main_example.py,Example CLI script demonstrating how to invoke the split_main function to split prompts into sub-prompts and modified prompts.,"[""split_cli"", ""cli""]","[""click"", ""pdd""]",ced192fcbfbfda15b35bd2dad5bbf4b4888acb091084cf58326832d224a77661
context/split_validation_example.py,"Demonstrates the usage of the `pdd.split_validation` API, including post-extraction validation and command resolution for tests and linters, using a mocked worktree.",[],"[""os"", ""subprocess"", ""sys"", ""tempfile"", ""dataclasses"", ""pathlib"", ""types"", ""typing"", ""unittest.mock"", ""rich"", ""pdd.split_validation""]",007c34d78c7605bb0ddfc3cb2df14095e387159b3ea746056e34cb304547a358
context/summarize_directory_example.py,"Demonstrates and tests all features of the summarize_directory module using mock LLM calls, including caching, progress callbacks, input validation, and error handling.","[""mock_llm_invoke"", ""main""]","[""os"", ""sys"", ""tempfile"", ""shutil"", ""unittest"", ""pdd""]",99f9b729f3b148891d471e79e5a29e67e39c30aad8e9922ced2982ca02b158ea
context/sync_animation_example.py,Demonstrates usage of the sync_animation module by simulating a PDD workflow with shared state variables and a threaded animation.,"[""mock_pdd_main_workflow""]","[""threading"", ""time"", ""os"", ""pdd""]",5b6a8af940fe44241889a279c1a8d3c978fe0c6ec3afc648510d8e33ffa7b18c
context/sync_code_main_example.py,"Demonstrates and tests the change-detection and repo-wide update pipeline from `pdd.update_main` using mocked Git, fingerprint, and LLM dependencies.",[],"[""hashlib"", ""os"", ""shutil"", ""dataclasses"", ""pathlib"", ""typing"", ""unittest"", ""click"", ""rich"", ""pdd""]",d917717f76f6d230b3e9ded9bf545898a7b47a291faf93c680d5964a0e2361b5
context/sync_determine_operation_example.py,"Demonstrates the sync_determine_operation function across four scenarios: new unit, test failure, manual code change, and synchronized state.",[],"[""os"", ""json"", ""hashlib"", ""pathlib"", ""datetime"", ""pdd""]",94a333b37d9875bcc9b39e22d4d00de1b196ad2f7e0fa997e6f638e153dbdfad
context/sync_main_example.py,Demonstrates the `sync_main` CLI function by setting up a mock project and simulating multi-language prompt synchronization with mocked dependencies.,"[""setup_mock_project"", ""main""]","[""json"", ""shutil"", ""pathlib"", ""unittest"", ""click"", ""rich"", ""pdd""]",3eb17c0e79c0402489782f7e758d7063dfbd820428c5e5b695415290ebf2a7f8
context/sync_orchestration_example.py,Example script demonstrating how to set up a mock PDD project and run sync orchestration in both full and dry-run modes.,"[""setup_example_project""]","[""json"", ""pathlib"", ""pdd""]",cc1313a948946026d418c85a07e5bf0eedeb5915c44d630440e489979755e1f7
context/sync_order_example.py,"Demonstrates the pdd.sync_order module by building dependency graphs, performing topological sorts, identifying affected modules, and discovering associated documentation files.","[""create_mock_prompts"", ""main""]","[""os"", ""shutil"", ""pathlib"", ""rich"", ""pdd""]",b4eb1e167e7604c7dbac703bdcba7287188fa9d2d5ef6d490216d003cdc542fa
context/tiktoken_example.py,Script that counts the number of tokens in a preprocessed prompt string using the tiktoken library with the cl100k_base encoding.,[],"[""tiktoken""]",0cc5e74006d0d30b399158127d9258105ce16be1815c012a08bafd3435f78f36
context/trace_example.py,Demonstrates the `pdd.trace` function by tracing a sample code line back to its corresponding prompt line and displaying results.,"[""main""]","[""os"", ""pdd"", ""rich""]",de4d5d1ca347ea7ef9acd11dc80e86188917f61355e68db9c397ca6fd5108f99
context/trace_main_example.py,Demonstrates using the `trace_main` function to trace a code line back to its corresponding prompt line in a simple calculator example.,[],"[""pdd"", ""click""]",c1f43ebf55c05af801640f5f8331ee7a674aef9e3f383b0e5ffee7abc7246fe1
context/track_cost_example.py,Defines the PDD command-line interface with a `generate` command that processes prompt files and produces outputs with cost tracking.,"[""cli"", ""generate""]","[""click"", ""typing"", ""os"", ""pdd"", ""rich""]",30c33d5c1c945e0e8f0c0f9861f8b952d1eb4f22e6cbc8c05089b160b1a4c8eb
context/unfinished_prompt_example.py,Example script demonstrating how to use the `unfinished_prompt` function to analyze whether a given prompt text is complete or needs continuation.,[],"[""pdd"", ""rich""]",5d4d74064e5b845391f035fb8631903ec2f39a54a90713f9c13dc24d2eb73c4f
context/update_main_example.py,Demonstrates various usage examples and operational modes for a CLI tool that updates and synchronizes prompts based on modified code files.,[],"[""os"", ""sys"", ""tempfile"", ""pathlib"", ""unittest"", ""click"", ""pdd""]",b318834c648f25e6141d81f3ecac1d9da592a6bb4740500983f2b07b8a10d902
context/update_model_costs_example.py,Demonstrates how to use the `pdd.update_model_costs.update_model_data` helper to populate LLM cost and metadata fields in a CSV file.,[],"[""pathlib"", ""os"", ""pandas"", ""pdd""]",90c9e0bab64d7495f55ba5876f8beab75ef40037508b5e9800ebc6afb5b55f5e
context/update_prompt_example.py,Demonstrates usage of the update_prompt function by updating a prompt based on original and modified code.,"[""main""]","[""os"", ""tabnanny"", ""pdd""]",56b9d8c7aa823c2996a3dc5741a47844e223bfd088366d74e48b6a099b5a11c4
context/websocket_example.py,"Implements WebSocket connection management, message protocol, subprocess output streaming, and interactive input handling for a FastAPI-based PDD server.","[""MessageType"", ""WSMessage"", ""StdoutMessage"", ""ProgressMessage"", ""InputRequestMessage"", ""CompleteMessage"", ""WebSocketConnection"", ""ConnectionManager"", ""OutputStreamer"", ""WebSocketInputHandler"", ""create_websocket_routes""]","[""asyncio"", ""json"", ""dataclasses"", ""datetime"", ""enum"", ""typing"", ""uuid"", ""fastapi"", ""pydantic""]",6f50399fd41177e47da3f170a1cc84380f8f266036e8f510f7807a916265ab0f
context/xml_tagger_example.py,Demonstrates example usage of the xml_tagger function to tag a raw prompt with XML and display results.,[],"[""pdd"", ""rich""]",3b4606a0ac11cb728a5aa657d457312c83f2d710f53f4ac94d35675f7e911f60
context/anthropic_thinking_test.py,"Script that tests LiteLLM's completion API with Anthropic Claude models, specifically validating the ""thinking"" (extended reasoning) parameter support.",[],"[""os"", ""litellm"", ""dotenv"", ""pathlib"", ""warnings"", ""rich""]",a442745e51983bb051292e5f260efdadc57d046504e50a7194af8e1872ce0c84
context/create_gcp_credential.py,"Script that retrieves a GCP Vertex AI service account credential from Azure Key Vault, decodes it from base64, and parses the JSON.",[],"[""base64"", ""json""]",22babc43e3ee7f5bdef36d1e4830b4ad65e4e3658f874f6914f88f6b7e0df2e0
context/detect_change/2/change_detect.csv,CSV manifest listing prompt files and their change instructions for inserting a shared Python preamble into multiple prompt templates.,[],[],853a291e2b92085b3471b1dc9ee9d8487dc8a4262043256766f89031c1639fcd
context/detect_change/2/prompt_list.json,"Defines four LLM prompt templates for Python code generation tasks: modifying prompts, preprocessing prompts with XML-like tags, assessing prompt completeness, and adding XML tags to prompts.","[""change_python.prompt"", ""preprocess_python.prompt"", ""unfinished_prompt_python.prompt"", ""xml_tagger_python.prompt""]",[],2126c50e4b33078edbfd15319b1f7e966afc6b6e495a8de3db68e2321348e266
context/execute_bug_to_unit_test_failure.py,A simple script that imports and calls the `add` function with sample arguments to print the result.,[],"[""context""]",cdc899979df1de48bba42fd026d5f980dc7381fdf224f8ab4db76554b69ee91e
context/final_llm_output.py,"Defines the PDD (Prompt-Driven Development) CLI with chainable subcommands for code generation, testing, preprocessing, error fixing, prompt splitting, changing, and updating.","[""cli"", ""processor"", ""generate"", ""example"", ""test"", ""preprocess"", ""fix"", ""split"", ""change"", ""update"", ""install_completion"", ""version"", ""track_cost"", ""process_commands""]","[""os"", ""functools"", ""typing"", ""click"", ""rich"", ""pdd""]",69322ebbb5b23b8d0f7c29f9f25fe28aff81a55cbed4fbd8be30652aa894cf47
context/fix_errors_from_unit_tests/1/conflicts_in_prompts.py,Analyzes two prompts for conflicts using a two-stage LLM pipeline and returns identified conflicts with resolution suggestions and cost estimates.,"[""Conflict"", ""ConflictOutput"", ""conflicts_in_prompts""]","[""os"", ""typing"", ""rich"", ""langchain_core""]",e1a0cd705e318d7f93d847b383a646ec764d0decc95526ddc68d616783fa8e21
context/fix_errors_from_unit_tests/1/test_conflicts_in_prompts.py,"Tests for the `conflicts_in_prompts` function, covering success cases, error handling, and custom parameter passing with mocked LLM and file dependencies.",[],"[""pytest"", ""unittest"", ""pdd"", ""langchain_core""]",1c49a90ac93a88b00811fb98b28661b6dd788cb9086b7778f232f5e692ada024
context/fix_errors_from_unit_tests/2/code_generator.py,"Orchestrates an LLM-based code generation pipeline including prompt preprocessing, model selection, generation, incompleteness detection, continuation, and postprocessing.","[""code_generator""]","[""typing"", ""rich"", ""langchain_core"", ""preprocess"", ""llm_selector"", ""unfinished_prompt"", ""continue_generation"", ""postprocess""]",112974499903ccf96fb523e49dea795f2928cceab035a1c6fe554073efec8a0e
