full_path,file_summary,date
"context/DSPy_example.py","This code snippet demonstrates the initial setup and implementation of a DSPy-based application focused on example selection. The code begins with importing necessary DSPy components and configuring OpenAI's GPT-3.5-turbo-instruct model as the language model backend, with a maximum token limit of 250. The core of the implementation is a 'chainofthought' class that inherits from dspy.Module. This class is designed to implement a chain-of-thought reasoning process, with a basic structure that includes initialization and a forward method to process questions. The class uses DSPy's ChainOfThought feature to map questions to answers. However, the code appears to be incomplete, as indicated by empty spaces and an unfinished comment about compilation and optimization. The code represents a basic framework for implementing chain-of-thought reasoning in a DSPy environment, though it needs additional implementation details to be fully functional.",2024-12-07T01:53:08.162193+00:00
"context/anthropic_counter_example.py","This Python code snippet demonstrates how to count tokens using the Anthropic API. The code first imports the Anthropic library and initializes a client. It then defines a sample text string ('Sample text') and uses the client's count_tokens method to determine the number of tokens in this text. Finally, it prints the token count to the console. The code includes a comment noting that this token counting method is not accurate for Anthropic models version 3.0 and above. Token counting is an important function when working with large language models since API costs and context limitations are typically based on token count rather than character count. This example provides a basic implementation of the token counting feature available in the Anthropic Python SDK.",2025-04-05T08:29:21.817367+00:00
"context/anthropic_tool_example.py","The provided code snippet demonstrates the use of the Anthropics API to interact with a language model named Claude. The script begins by importing the anthropic library and initializing a client instance. It then constructs a request to the model, specifying parameters such as the model version, maximum token limit, and tools to be used. In this case, a text editor tool named 'str_replace_editor' is included. The main message sent to the model is from a user who reports a syntax error in a file named 'patent.md' and requests assistance in fixing it. Finally, the response from the model is printed to the console. This code illustrates a practical application of AI in debugging and editing text files.",2025-04-15T07:05:53.321600+00:00
"context/auto_deps_main_example.py","The provided Python script is a command-line tool implemented using the Click library. It defines a command named 'auto-deps' that facilitates dependency analysis and processing of prompt files. The script includes several command-line options, such as '--force' to overwrite files, '--quiet' to suppress output, '--strength' and '--temperature' to configure dependency analysis parameters, and paths for input prompt files, directories, and output files. The main function initializes the Click context with these options and invokes the 'auto_deps_main' function from the 'pdd.auto_deps_main' module. This function processes the specified prompt file, analyzes dependencies, and generates a modified prompt file. The script also calculates and displays the total cost of the operation and the model used. Error handling is implemented to catch exceptions and abort execution if necessary. The script is designed to be executed as a standalone program.",2024-12-13T21:07:14.439152+00:00
"context/auto_include_example.py","This Python script demonstrates the usage of the `auto_include` function from the `pdd.auto_include` module. The script loads a CSV file containing project dependencies and defines parameters for the `auto_include` function, including an extensive input prompt. The prompt describes a function called `generate_test` that creates unit tests from code files using Langchain and LLMs. The script specifies parameters such as directory path ('context/c*.py'), strength (0.97), temperature (0.5), and verbosity setting. After calling `auto_include` with these parameters, it prints the results including dependencies, CSV output, total cost of LLM usage, and the model name used. The example illustrates an automated workflow for code analysis and test generation that includes prompt processing, LLM integration, token counting, and cost tracking.",2025-03-19T23:31:14.602995+00:00
"context/auto_update_example.py","The file provides an example of how to use the 'auto_update' function from the 'pdd.auto_update' module. It includes a Python script that demonstrates various ways to utilize the function. The 'auto_update' function is designed to check the current installed version of a package, compare it with the latest version (either from PyPI or a specified version), and prompt the user to upgrade if a newer version is available. If the user confirms, the function performs the upgrade using pip. The script showcases basic usage for checking updates for the 'pdd' package, checking updates for a specific package like 'requests,' and comparing against a known version, such as 'pandas' version 2.0.0. The script is structured with a 'main' function that encapsulates these examples, and it is executed when the script is run directly. The file serves as a guide for implementing and understanding the 'auto_update' function's capabilities.",2025-01-01T07:17:26.468121+00:00
"context/autotokenizer_example.py","This Python code defines a function called 'count_tokens' that calculates the number of tokens in a given text using a specified language model's tokenizer. The function uses the Hugging Face transformers library, specifically the AutoTokenizer class. By default, it uses the 'deepseek-ai/deepseek-coder-7b-instruct-v1.5' model, but this can be changed through the model_name parameter. The function works by first loading the appropriate tokenizer, then tokenizing the input text, and finally returning the length of the resulting input_ids. The code includes a simple example that demonstrates how to use the function by counting tokens in the text 'Write a quick sort algorithm in Python.' This utility is particularly useful for working with language models where understanding token count is important for managing context windows and input limitations.",2024-12-07T01:53:08.299472+00:00
"context/bug_main_example.py","This Python script demonstrates the use of `bug_main` function from the `pdd` package to automatically generate unit tests based on the difference between observed and desired program outputs. The script begins by setting up a Click context with configuration parameters for the test generation process. It then creates sample files in an output directory, including a prompt file describing requirements for a function that sums even numbers in a list, an implementation file with a potential bug (doesn't handle empty lists correctly), a program file that uses this function, and files containing current and desired outputs. The script calls `bug_main` with these inputs to generate a unit test that would catch the identified bug. The function returns the generated test code, the cost of the operation (presumably from using an AI model), and the name of the model used. The example illustrates an automated debugging workflow where the system identifies that the sum_even_numbers function fails to return 0 for empty lists as specified in the requirements.",2025-03-19T23:31:14.628478+00:00
"context/bug_to_unit_test_example.py","This Python script demonstrates the usage of a bug_to_unit_test function for automated test generation. The main function serves as the entry point and orchestrates the process of generating unit tests from bug reports. The script reads input from three different files: a prompt file (from 'prompts' directory), a code file (from 'pdd' directory), and a context file (from 'context' directory). It processes two types of outputs (current and desired) that contain debug information and JSON-formatted explanations. The function takes several parameters including the outputs, prompt, code under test, program to run the code, strength (0.9), temperature (0), and language ('Python'). The script uses the Rich library for enhanced console output formatting, displaying the generated unit test, total cost, and model name used. Error handling is implemented to catch and display any exceptions that occur during execution. The code appears to be part of a larger system for automated testing and debugging, possibly using AI/LLM models given the presence of temperature and strength parameters.",2024-12-07T01:53:08.330225+00:00
"context/bug_to_unit_test_failure_example.py","This code snippet contains a Python function named 'add' that takes two parameters 'x' and 'y'. However, there appears to be a logical error in the implementation. Despite the function name suggesting addition, the function actually performs subtraction, returning 'x-y' instead of 'x+y'. This is likely a bug that needs to be fixed to match the intended functionality implied by the function name. The code is very simple, consisting of just two lines: the function definition and the return statement. The indentation suggests this might be part of a larger codebase, but only this single function is shown in the provided content.",2024-12-07T01:53:08.365017+00:00
"context/change_example.py","The provided Python script demonstrates the use of a `change` function from the `pdd.change` module. It includes a `main` function that sets up environment variables, defines input parameters, and calls the `change` function. The script outlines an example scenario where a function to calculate the factorial of a number is modified based on a prompt to take the square root of the factorial output. Parameters such as `strength` and `temperature` are used to control the behavior of the `change` function. The script also handles potential exceptions and prints the modified prompt, total cost, and model name using the `rich.console` module for formatted output. The `main` function is executed when the script is run directly.",2024-12-21T03:10:15.598748+00:00
"context/change_main_example.py","The provided Python script demonstrates the usage of the 'change_main' function from the 'pdd' command-line program, showcasing both single-change and CSV batch-change modes. It begins by importing necessary modules and setting up a Click context for command-line options. The script outlines prerequisites for running the 'change_main' function, including the availability of the module and required packages. In single-change mode, it creates sample input files, modifies a function to add error handling for division by zero, and displays the modified output along with the total cost and model used. The script also illustrates CSV batch-change mode by creating multiple sample code files and a CSV file that specifies changes for batch processing. It then calls 'change_main' in this mode, displaying the results and total cost. The script emphasizes the importance of setting up directories and files correctly for both modes, and it utilizes the 'rich' library for formatted output. Overall, the script serves as a practical example for users looking to implement changes in Python code using the 'pdd' tool.",2025-02-09T07:16:17.092974+00:00
"context/cli_example.py","The provided Python script demonstrates the usage of the 'generate' command from the PDD CLI module to create runnable code from a specified prompt file. It begins by disabling auto-update through an environment variable and defines a main function that outlines the process of code generation. The script assumes that necessary environment variables are set and required packages are installed. It specifies the input prompt file and the output file where the generated code will be saved. The script sets command line arguments for the generation process, including parameters for the AI model's strength and temperature, and forces generation without user confirmation. The CLI command is executed within a try-except block to handle potential errors gracefully. If successful, the generated code is saved to the designated output file, and the total cost and model name used for generation are printed to the console. The script is designed to be run as a standalone program.",2025-02-09T07:16:24.946452+00:00
"context/click_example.py","This Python script implements a command-line image processing tool using Click and Pillow (PIL) libraries. It follows a Unix-like pipe pattern where multiple image processing commands can be chained together. The script includes various image manipulation functions such as opening, saving, displaying, resizing, cropping, transposing (rotation and flipping), blurring, smoothening, embossing, sharpening, and pasting images. Each command is implemented as a Click command group with specific options and parameters. The script uses decorator patterns (@processor and @generator) to handle the command chain processing. Key features include:

1. Command chaining functionality similar to Unix pipes
2. Support for multiple input images
3. Various image transformation options
4. Error handling for image operations
5. Flexible file naming for output
6. Preservation of image filenames through transformations

The script is well-documented with docstrings and comments, making it clear how to use each command and what it does. Example usage shows commands can be combined like 'imagepipe open -i example.jpg resize -w 128 display' to process images in sequence.",2024-12-07T01:53:08.509553+00:00
"context/cloud_function_call.py","The provided code is a Python script that demonstrates how to call a Google Cloud Function using the requests library. It defines a function named `call_cloud_function` that takes a Firebase token as an argument. The function constructs a request to a specified Cloud Function URL, including the Firebase token in the Authorization header to authenticate the request. The URL is hardcoded as 'https://us-central1-prompt-driven-development.cloudfunctions.net/on_request_example'. After making the GET request, the function returns the JSON response from the Cloud Function. The script also includes a sample Firebase token, which is a long string used for authentication. Finally, the script calls the `call_cloud_function` with the provided token and prints the result. This code is useful for developers looking to integrate Firebase authentication with Google Cloud Functions.",2025-02-09T07:16:28.890615+00:00
"context/cmd_test_main_example.py","The file 'test_cli_example.py' provides an example of integrating the 'cmd_test_main' function into a Click-based command-line interface (CLI) for generating or enhancing unit tests. It includes a detailed explanation of its usage, required and optional arguments, and the expected output. The script defines a CLI with global options such as verbosity, AI generation strength, temperature, force overwrite, and quiet mode. It also includes a 'test' command that accepts arguments like 'prompt_file' (path to a text file), 'code_file' (path to the source code), and optional parameters such as output path, programming language override, coverage report, existing tests, target coverage percentage, and a merge flag. The 'test' command invokes the 'cmd_test_main' function to generate or enhance unit tests, returning the generated test code, total cost, and model name. The script demonstrates how to run the CLI from the command line with examples and provides flexibility for customizing test generation. It uses the Click library for CLI creation and ensures shared context across commands. The script is designed for developers looking to automate or improve their unit testing process using AI-driven tools.",2025-01-01T07:17:35.334047+00:00
"context/code_generator_example.py","The provided Python script demonstrates the usage of a function called 'code_generator' from the 'pdd.code_generator' module. The script's main function reads a prompt from a file ('prompts/generate_test_python.prompt') and uses it to generate Python code with the help of a language model. Key parameters for the 'code_generator' function include the programming language ('python'), model strength (0.5), temperature (0.0), and verbosity (True). The script attempts to generate runnable code, calculate the total cost, and identify the model name. If successful, it prints the generated code, cost, and model name. In case of an error, it catches and prints the exception. The script is designed to be executed as a standalone program with the main function serving as the entry point.",2024-12-21T03:10:19.903389+00:00
"context/code_generator_main_example.py","The provided code is a Python script that utilizes the Click library to create a command-line interface (CLI) for generating code based on a specified prompt. It sets up a Click context with parameters such as 'strength', 'temperature', 'force', and 'quiet' to control the behavior of the AI model used for code generation. The script defines paths for a prompt file and an output file, where the prompt file contains instructions for generating a Python function that retrieves a JSON Web Token (JWT). The code generation is executed by calling the 'code_generator_main' function, which takes the Click context, prompt file, and output file as arguments. After the code is generated, the script prints the generated code, the total cost of the operation, the model used for generation, and the location where the code is saved. The script also includes commented-out sections for creating a prompt file and output directory, indicating that it is designed for flexibility in generating various code snippets.",2025-02-09T07:16:32.177765+00:00
"context/comment_line_example.py","This file provides documentation and examples for a Python function called `comment_line` that handles code commenting across different programming languages. The function takes two parameters: `code_line` (the line to be commented) and `comment_characters` (the commenting syntax to use). The function supports three commenting styles: single-character comments (like Python's #), paired comments (like HTML's <!-- -->), and line deletion (using 'del'). The documentation includes the function's definition with detailed parameter descriptions and return value information. The file also contains practical examples demonstrating all three use cases: commenting a Python print statement, commenting an HTML tag, and deleting a line of code. Each example is accompanied by its expected output. The function is designed to be flexible and can accommodate different programming language commenting syntaxes by appropriately formatting the input line based on the specified comment characters.",2024-12-07T01:53:08.574892+00:00
"context/conflicts_in_prompts_example.py","The provided Python script demonstrates the use of a function named `conflicts_in_prompts` to detect and resolve conflicts between two example prompts. The script imports necessary modules, including `conflicts_in_prompts` from `pdd.conflicts_in_prompts` and `print` from the `rich` library for formatted output. The main function defines two detailed prompts: one for creating an `auth_helpers.py` module for Firebase authentication and another for designing a `User` class for the PDD Cloud platform. Each prompt includes specific requirements, such as functionality, dependencies, error handling, and coding standards. The script sets parameters like `strength`, `temperature`, and `verbose` for the conflict detection process. It then calls the `conflicts_in_prompts` function with the prompts and parameters, capturing the suggested changes, total cost, and model name. The results are displayed using formatted output, highlighting any detected conflicts and proposed changes. If no conflicts are found, a corresponding message is printed. The script is structured to showcase the functionality of the `conflicts_in_prompts` function while adhering to Python best practices, including type hints, docstrings, and modular design.",2024-12-21T03:10:21.724675+00:00
"context/conflicts_main_example.py","The provided code snippet is a Python script that utilizes the Click library and a custom function from the 'pdd.conflicts_main' module. It begins by defining two prompt files, 'prompt1_LLM.prompt' and 'prompt2_LLM.prompt', which contain instructions for an AI assistant and a chatbot, respectively. The script then creates these prompt files and writes the corresponding text into them. A mock context class, 'MockContext', is defined to simulate a Click context, which includes attributes like 'force', 'quiet', 'strength', and 'temperature'. The script then calls the 'conflicts_main' function with the mock context and the two prompt files, capturing the output in 'conflicts_output.csv'. It prints the number of conflicts, the total cost associated with the operation, and the model used for processing. The results are intended to be saved in a CSV file for further analysis. Overall, the script demonstrates how to set up prompts for an AI model and handle conflicts in a structured manner.",2025-02-09T07:16:35.220463+00:00
"context/construct_paths_example.py","The provided code is a Python script that demonstrates the usage of a function called `construct_paths` from the `pdd.construct_paths` module. The script defines a `main` function that orchestrates the process of setting up input parameters, invoking the `construct_paths` function, and handling its output. It begins by specifying input file paths for code and prompt files, followed by defining command options such as output settings. The script attempts to call `construct_paths` with these parameters, capturing the input strings, output file paths, and the programming language used. It includes error handling to manage any exceptions that may arise during the function call. The script repeats this process for different sets of input file paths and command options, demonstrating its flexibility in generating outputs based on various prompts. The final part of the script constructs file paths for a regression test prompt and generates corresponding outputs. Overall, the script serves as a practical example of how to utilize the `construct_paths` function for file management and output generation in a Python environment.",2025-02-09T07:16:38.839339+00:00
"context/context_generator_example.py","This Python script demonstrates the usage of a context generator tool for code generation. The script first checks for the required environment variable 'PDD_PATH' and imports necessary modules. It then sets up input parameters including a sample Python function (add), a corresponding prompt, programming language specification, and model parameters like strength and temperature. The script calls the context_generator function with these parameters to generate example code. The function returns three values: the generated example code, the cost of generation, and the name of the model used. Finally, the script prints the results using Rich library's formatted output, displaying the generated code, total cost, and the model name used for generation. This appears to be a demonstration or test script for a code generation system that likely uses AI models to generate code based on prompts.",2025-02-16T18:20:44.136786+00:00
"context/context_generator_main_example.py","The provided Python script utilizes the Click library to create a command-line interface (CLI) context for executing a function named `context_generator_main` from the `pdd.context_generator_main` module. The script initializes a Click context object with specific parameters and attributes, such as `force`, `quiet`, `verbose`, `strength`, and `temperature`, which control the behavior of the CLI and the AI model. It specifies input and output file paths, including a prompt file, a code file, and an output file where the generated code will be saved. The `context_generator_main` function is then called with the configured context and file paths, and it returns the generated code, the total cost of the operation, and the name of the AI model used. Finally, the script prints the generated code, the total cost, and the model name to the console. The script appears to be part of a larger system for generating Python code based on prompts and AI model configurations.",2025-01-01T07:17:47.378733+00:00
"context/continue_generation_example.py","The provided Python script demonstrates the usage of the `continue_generation` function, which extends text generation using a language model and calculates associated costs. The script begins by loading input data from external files: a formatted input prompt from `context/cli_python_preprocessed.prompt` and an initial LLM output fragment from `context/llm_output_fragment.txt`. It sets parameters for the language model, including `strength` and `temperature`, and then calls the `continue_generation` function with these inputs. The function returns the final generated output, the total cost of the operation, and the model name. The script prints the total cost and model name to the console and writes the final generated output to a file named `context/final_llm_output.py`. Error handling is implemented to catch and report file-related or general exceptions. The script is designed to be executed as a standalone program with the `main` function serving as the entry point.",2024-12-21T03:10:26.974173+00:00
