full_path,file_summary,key_exports,dependencies,content_hash
context/fix_errors_from_unit_tests/2/test_code_generator.py,"Unit tests for the `code_generator` function, covering successful generation, incomplete generation with continuation, and exception handling scenarios.","[""test_code_generator_success"", ""test_code_generator_incomplete_generation"", ""test_code_generator_exception_handling""]","[""pytest"", ""unittest""]",f17f51a3df266a3912ce071c83a62889d2b2d3d4281dc84f578e8c5fce032a4c
context/fix_errors_from_unit_tests/3/context_generator.py,"Generates example code using a language model by orchestrating prompt loading, preprocessing, LLM invocation, incomplete output detection, and postprocessing.","[""context_generator""]","[""os"", ""typing"", ""rich"", ""langchain""]",13e2be9a3c3f6fc3e1bce5184358a9d3aa2c4eb161d9f75022b4354c0fe3453d
context/fix_errors_from_unit_tests/3/test_context_generator.py,"Unit tests for the `context_generator` function, covering success, unfinished prompt continuation, missing environment variables, file-not-found, and general exception handling scenarios.",[],"[""pytest"", ""unittest""]",653b103f8921a11155192345c234a1856a80bc190b9baca47c5f19e4b23a9b3f
context/fix_errors_from_unit_tests/4/detect_change.py,Analyzes prompt files against a change description using LLM chains to detect which prompts need modification and returns structured change instructions.,"[""detect_change"", ""custom_chain_executor""]","[""os"", ""typing"", ""rich"", ""langchain_core"", ""json""]",43ad9e25e79a3f7c6e0dd30ee31c2d28a96602ee14c0a93e00407c511664e30b
context/fix_errors_from_unit_tests/4/detect_change_1_0_1.py,Analyzes prompt files against a change description using an LLM to detect which prompts need modification and extracts structured change instructions.,"[""detect_change""]","[""os"", ""typing"", ""rich"", ""langchain_core"", ""json""]",8f6abd862b4b6bfb75367f9e0e891e3587830f6616bae02e3b0bbd13bf571ade
context/fix_errors_from_unit_tests/4/test_detect_change.py,"Unit tests for the `detect_change` and `custom_chain_executor` functions, covering success, file-not-found, JSON decode error, and unexpected error scenarios.","[""MockPromptTemplate"", ""MockLLM"", ""MockOutputParser"", ""mock_environment"", ""mock_file_contents"", ""mock_llm_selector"", ""mock_preprocess"", ""test_detect_change_success"", ""test_detect_change_file_not_found"", ""test_detect_change_json_decode_error"", ""test_detect_change_unexpected_error""]","[""pytest"", ""unittest"", ""pdd"", ""json"", ""rich""]",8323dc0c5697c60fb4d86275525538e8500805a1a2b2f8e9875f96f462184111
context/fix_errors_from_unit_tests/4/test_detect_change_1_0_1.py,"Unit tests for the `detect_change` function covering success, file-not-found, JSON decode error, and unexpected error scenarios.","[""test_detect_change_success"", ""test_detect_change_file_not_found"", ""test_detect_change_json_decode_error"", ""test_detect_change_unexpected_error"", ""mock_environment"", ""mock_file_contents"", ""mock_llm_selector"", ""mock_preprocess""]","[""pytest"", ""unittest"", ""pdd"", ""json"", ""rich""]",ce21ab0c26b1dc32f6d00ad1699a191804913e3cdabce68b68cfb968241e90e5
context/fix_errors_from_unit_tests/5/continue_generation.py,"Implements iterative LLM-based code generation continuation with trimming, completion detection, and cost tracking.","[""TrimResultsOutput"", ""TrimResultsContinuedOutput"", ""extract_text_from_response"", ""continue_generation""]","[""os"", ""json"", ""typing"", ""rich"", ""langchain_core""]",60870002c908d1af45df2bb36cccf3c0ffac431e52f8a52881982a97dea7b7e0
context/fix_errors_from_unit_tests/5/continue_generation_2_0_1.py,"Implements an iterative LLM continuation loop that extends incomplete code generations, trims results, and tracks token costs until output is finished.","[""TrimResultsOutput"", ""TrimResultsContinuedOutput"", ""continue_generation""]","[""os"", ""typing"", ""rich"", ""langchain_core""]",c1c92431563dde04a966bfc7d11408f82ac7a350c872b2615d9deacaf920db6e
context/fix_errors_from_unit_tests/5/test_continue_generation.py,"Tests for the `continue_generation` function, verifying success paths, error handling, multiple iterations, and cost calculation.","[""test_continue_generation_success"", ""test_continue_generation_missing_env_variable"", ""test_continue_generation_file_not_found"", ""test_continue_generation_multiple_iterations"", ""test_continue_generation_cost_calculation""]","[""pytest"", ""unittest"", ""pdd"", ""rich""]",08fc2afe93e17da1d224e31652ea38b3a383a1a4672d2b8f90bfbbdd4f17184f
context/fix_errors_from_unit_tests/5/test_continue_generation_2_0_1.py,"Tests for the `continue_generation` module, verifying success paths, error handling, multiple iterations, and cost calculation.","[""test_continue_generation_success"", ""test_continue_generation_missing_env_variable"", ""test_continue_generation_file_not_found"", ""test_continue_generation_multiple_iterations"", ""test_continue_generation_cost_calculation""]","[""pytest"", ""unittest"", ""pdd"", ""rich""]",967abdff9f87433d54f94bcb50397587a8330cd3fc854da619f2bdcf616dd39a
context/gcs_hmac_test.py,Script that uploads a test file to Google Cloud Storage using boto3 with GCS HMAC keys via the S3-compatible API.,"[""main""]","[""boto3"", ""os"", ""botocore"", ""logging"", ""dotenv""]",965d3bb183e7e3898690b121a76ae0c57eb96425e7b670cecc50b829ea003bab
context/generate/1/fix_errors_from_unit_tests.py,Uses LLM chains to analyze unit test errors and generate fixes for both the test code and the source code.,"[""fix_errors_from_unit_tests""]","[""os"", ""rich"", ""langchain_core"", ""langchain_community"", ""langchain"", ""llm_selector""]",7a3eb969bcaa76dc85d59c4013a41a7da5bb7472daf97df2b2cad0475642d2c7
context/generate/2/cli.py,"Defines the PDD (Prompt-Driven Development) CLI with commands for code generation, testing, preprocessing, error fixing, prompt splitting, changing, and updating.","[""cli"", ""log_cost"", ""get_paths_for_shell"", ""generate"", ""example"", ""test"", ""preprocess"", ""fix"", ""split"", ""change"", ""update"", ""install_completion""]","[""os"", ""click"", ""rich"", ""csv"", ""datetime"", ""langchain"", ""langchain_community"", ""subprocess""]",b607c3e67702ad3bc5e61cc40ce85571e4ff09015de96016c8d7d56eb78b8c74
context/generate/3/cli.py,"Defines the Click-based CLI for the PDD (Prompt-Driven Development) tool, providing commands for code generation, testing, preprocessing, error fixing, prompt splitting, change detection, and conflict analysis.","[""cli"", ""track_cost"", ""generate"", ""example"", ""test"", ""preprocess"", ""fix"", ""split"", ""change"", ""update"", ""detect"", ""conflicts"", ""crash"", ""install_completion""]","[""os"", ""csv"", ""datetime"", ""functools"", ""typing"", ""click"", ""rich""]",43a3aaf18afc0af2bc214890f87e561f5f61e885452c4dc69daff01818e1eb4c
context/generate/4/cli.py,"Defines the Click-based CLI for the PDD (Prompt-Driven Development) tool, exposing commands for code generation, testing, preprocessing, error fixing, prompt splitting, change detection, conflict analysis, and tracing.","[""cli"", ""generate"", ""example"", ""test"", ""preprocess"", ""fix"", ""split"", ""change"", ""update"", ""detect"", ""conflicts"", ""crash"", ""bug"", ""trace"", ""install_completion""]","[""os"", ""csv"", ""datetime"", ""functools"", ""typing"", ""click"", ""rich""]",aeaaceab84a98e9cb777d691f1a9de4aa3538569ce0fa0b732228c8dfbae51cf
context/generate/5/generate_output_paths.py,"Generates output file paths for various PDD commands based on explicit values, environment variables, or default naming conventions.","[""generate_output_paths""]","[""os"", ""pathlib"", ""typing""]",78a4d97bd4c80d164c19e59efdf0153d6d7eafb75faf4f077ed630e15602ad17
context/generate/6/conflicts_main.py,"Analyzes conflicts between two prompt files, outputs results to CSV, and provides user feedback via the CLI.","[""conflicts_main""]","[""csv"", ""sys"", ""typing"", ""click"", ""rich""]",e7a05ba27d622574ff90a578304b063aa68970bdd270edf852c86f13d9470937
context/generate/7/code_generator_main.py,"Provides the main entry point for generating code from a prompt file using CLI context, handling path construction, code generation, output saving, and user feedback.","[""code_generator_main""]","[""sys"", ""typing"", ""click"", ""rich"", ""construct_paths"", ""code_generator""]",319d4e3596f837183ff589638fe6ac87f180b95d7c0956bfa9f3c77e787ab0dd
context/generate/8/llm_invoke.py,"Provides a unified LLM invocation interface that selects models by strength, manages prompt templates, and calculates token costs across multiple providers.","[""CompletionStatusHandler"", ""ModelInfo"", ""load_models"", ""select_model"", ""create_llm_instance"", ""calculate_cost"", ""llm_invoke""]","[""os"", ""csv"", ""json"", ""pydantic"", ""rich"", ""langchain_core"", ""langchain_community"", ""langchain"", ""langchain_openai"", ""langchain_fireworks"", ""langchain_anthropic"", ""langchain_google_genai"", ""langchain_groq"", ""langchain_together"", ""langchain_ollama""]",3a0d5138cc2b1f6668a94dff40cf5d97376bde2581e83e2538c3ef012a94f1bf
context/incremental_prd_architecture_example.py,"Demonstrates usage of the incremental PRD architecture module through examples of patch application, validation of unsafe patches, and full propagation flows using mocked LLMs.","[""example_apply_patch_directly"", ""example_validators_reject_unsafe_patches"", ""example_run_full_propagation"", ""example_dry_run"", ""main""]","[""json"", ""sys"", ""pathlib"", ""unittest"", ""pdd""]",d5436c9ceb2507fad7d325239c2ff7d459068471442b6edd96804413ab860fdf
context/litellm_bedrock_sonnet.py,Script demonstrating a simple chat completion call to AWS Bedrock Claude 3.7 Sonnet via litellm with low reasoning effort.,[],"[""litellm""]",3a0bb8269d3a765b728a09be9fca29f7b932f2860111dde2a79f370192eefea4
context/o4-mini-test.ipynb,Demonstrates a multi-turn chat completion request to Azure OpenAI's o4-mini model using the AzureOpenAI Python client.,[],"[""openai""]",ce3de59ca52b7ca7623749f0a07887bd1dba25bc21da0b32a2a1c51c61b995f9
context/postprocessed_runnable_llm_output.py,Defines a `context_generator` function that reads a Python file and generates a GPT-4 prompt to produce usage examples for the module.,"[""context_generator""]","[""os""]",ca0e49021f9ba3ff162c1a8a98ef4639e49b1d4a0c22d143e2dc808e385325f2
context/prompt_caching.ipynb,"Demonstrates Anthropic API prompt caching for single-turn and multi-turn conversations, showing latency and cost improvements using a large book as context.","[""ConversationHistory"", ""fetch_article_content"", ""make_non_cached_api_call"", ""make_cached_api_call"", ""simulate_conversation""]","[""anthropic"", ""time"", ""requests"", ""bs4""]",c9d723779341cfa01e6f78abd1128aae8ecdf66ba2c4cada31880df0b3668ff4
context/regression_example.sh,"Bash regression test script that exercises various PDD CLI commands (generate, example, test, preprocess, update, change, fix, split, detect, conflicts, crash) and logs results with cost tracking.",[],[],e4df58d36270ab7c005dfa8a111159c78bf149378510ae3423fb83efeb8f622a
context/simple_math.py,Empty placeholder file with no functional content.,[],[],23798297717fdc449fb01b557103f0e3b7aa46b535e91953cbca5fcf2aae0ecb
context/split/1/pdd.py,CLI tool that compiles prompt files into runnable code and generates example code from code files using argparse and rich.,"[""main"", ""get_file_paths"", ""get_extension"", ""get_example_extension"", ""confirm_overwrite""]","[""os"", ""sys"", ""argparse"", ""rich"", ""code_generator"", ""context_generator""]",e748fdf06a3f0bfed6c18bdcb1d7c8a7a78c18256dfb51adfd99086c3a14f2cc
context/split/1/split_get_extension.py,A single-line code snippet that calls a function to retrieve a file extension based on a given language.,[],[],9e3fc213b536b755722c8c4c407d92e88d22e64ab0d491b0c5e1d22b746f2500
context/split/2/pdd.py,CLI tool that compiles prompt files into runnable code and generates example code files using code_generator and context_generator.,"[""main"", ""write_to_file""]","[""os"", ""sys"", ""argparse"", ""rich"", ""code_generator"", ""context_generator"", ""get_extension""]",1021df55a642878527ad41794379eb1ba835c739a1e6f13b0896f2a0605ff8c2
context/split/2/split_pdd_construct_output_path.py,Code snippet demonstrating a call to construct_output_paths with named arguments for generating runnable and example output file paths.,[],[],0f2ab7543853ba418ad7d35b3fd113a5312e5ecc6117ad906aa77931e6190215
context/split/3/postprocess.py,"Extracts and isolates the largest matching code block from LLM output, commenting out all other lines using language-specific comment characters.","[""find_section"", ""postprocess""]","[""pdd""]",7bd1d2cf74436558a0fa14db3d7fc31abf6fcced57faa1d875a70a5566be23ae
context/split/3/split_postprocess_find_section.py,Demonstrates a call to the `find_section` function with parameters for parsing lines of text into sections.,[],[],31bd47832cd2fb2ad1787a9d7b4064af1d57dc3dfba26b64dbd7d15a78cc571f
context/split/4/construct_paths.py,"Constructs input/output file paths for a CLI code generation tool, handling language detection, filename conventions, and overwrite confirmation.","[""generate_output_filename"", ""construct_paths""]","[""os"", ""click"", ""rich"", ""get_extension""]",c227dc44f90465b64f94000958c11eb8885854466becf403a7f19e61519b50d2
context/split/4/split_construct_paths_generate_output_filename.py,"A function call snippet that invokes generate_output_filename with command, key, basename, language, and file extension parameters.",[],[],2c39060071cc48ca5baab6467c4c4cbcfa5e7cb8eb9e1d05d2b0a892f4f5185a
context/split/5/cli.py,"Defines the Click-based CLI for the PDD (Prompt-Driven Development) tool, exposing commands for code generation, testing, preprocessing, error fixing, prompt splitting, change detection, conflict analysis, tracing, and cost tracking.","[""cli"", ""track_cost"", ""generate"", ""example"", ""test"", ""preprocess"", ""fix"", ""split"", ""change"", ""update"", ""detect"", ""conflicts"", ""crash"", ""bug"", ""trace"", ""install_completion""]","[""os"", ""csv"", ""datetime"", ""functools"", ""typing"", ""click"", ""rich""]",9eea12ec7e9e8f98c0075207b0d88e60c3e01bc1128e25e0c80362028ae1d217
context/split/5/split_track_cost.py,"A decorator or annotation snippet for tracking cost, likely part of a larger module's instrumentation or monitoring system.","[""track_cost""]",[],92e4ef534572378e08209f913e43d248e18cd10e70de8f2fa15528cbc41200e1
context/split/6/cli.py,"Defines the Click-based CLI for the PDD (Prompt-Driven Development) tool, exposing commands for code generation, testing, preprocessing, error fixing, prompt splitting, change detection, conflict analysis, and tracing.","[""cli"", ""generate"", ""example"", ""test"", ""preprocess"", ""fix"", ""split"", ""change"", ""update"", ""detect"", ""conflicts"", ""crash"", ""bug"", ""trace"", ""install_completion""]","[""os"", ""csv"", ""datetime"", ""functools"", ""typing"", ""click"", ""rich""]",aeaaceab84a98e9cb777d691f1a9de4aa3538569ce0fa0b732228c8dfbae51cf
context/split/6/split_conflicts.py,"Defines a CLI command that analyzes two prompt files for conflicts and suggests resolutions, outputting results to CSV.","[""conflicts""]","[""click""]",ed275ba6d2c4742df3bab8eb78f6cb38b855677364244b0fc205625d73c579ee
context/split/7/cli.py,"Defines the Click-based CLI for the PDD (Prompt-Driven Development) tool, exposing commands for code generation, testing, preprocessing, error fixing, prompt splitting/changing/updating, conflict detection, tracing, and bug analysis.","[""cli"", ""generate"", ""example"", ""test"", ""preprocess"", ""fix"", ""split"", ""change"", ""update"", ""detect"", ""conflicts"", ""crash"", ""install_completion"", ""bug"", ""trace""]","[""os"", ""csv"", ""datetime"", ""functools"", ""typing"", ""click"", ""rich""]",d62918ef5903ffb5fb0b194a9321cf8742f2d51ace5e2ee3bec9e9e0e8d266bd
context/split/7/split_trace_main.py,Defines a CLI command that traces the association between a prompt file line and a generated code line.,"[""trace""]","[""click""]",d9a7d733a1fd74b5d3d0e25c298bef38b6951880f0f86f645cfe07cde092905f
context/split/8/change_main.py,Defines a CLI 'change' command that modifies an input prompt file based on a change prompt and corresponding input code.,"[""change""]","[""click""]",549e436acc4baf223c73decdf493d11dd9ab063bb938dea05b001efac351a13a
context/split/8/cli.py,"Defines the Click-based CLI for the PDD (Prompt-Driven Development) tool, exposing commands for code generation, testing, preprocessing, error fixing, prompt splitting/changing/updating, conflict detection, and tracing.","[""cli"", ""generate"", ""example"", ""test"", ""preprocess"", ""fix"", ""split"", ""change"", ""update"", ""detect"", ""conflicts"", ""crash"", ""bug"", ""trace"", ""install_completion""]","[""os"", ""csv"", ""datetime"", ""functools"", ""typing"", ""click"", ""rich""]",8950b0a13caf9936d281dde770fb572bec99060800e2c0b1d68a5ca7fa631f3a
context/split/9/cli.py,"Defines the main Click CLI entry point for the PDD (Prompt-Driven Development) tool, registering subcommands for code generation, testing, fixing, preprocessing, and more.","[""cli"", ""get_local_pdd_path"", ""get_shell_rc_path"", ""get_current_shell"", ""get_completion_script_extension"", ""generate"", ""example"", ""test"", ""preprocess"", ""fix"", ""split"", ""change"", ""update"", ""detect"", ""conflicts"", ""crash"", ""trace"", ""bug"", ""auto_deps"", ""install_completion""]","[""os"", ""sys"", ""importlib"", ""datetime"", ""functools"", ""typing"", ""click"", ""rich""]",41969c39b8121b5c9469fedfbee6c6fe1ab6df04eda07b1472621368dcee0801
context/split/9/install_completion.py,Defines a CLI command that installs shell completion for the application.,"[""install_completion""]",[],1eac80184769c28eccb35e1baba1eeded8b464cd01de7129c386d9a28ca50cd1
context/split/simple_math/split_script.py,Provides a simple addition function with type checking for numeric inputs.,"[""add""]",[],74e08259f6febb7c93e191d0687e3fb5c30358b920e108d6798146fb9141c0e3
context/unrunnable_raw_llm_output.py,"Implements a `context_generator` function that reads a Python file, preprocesses it, generates a GPT-4 prompt, and writes usage examples to an output file.","[""context_generator""]","[""os""]",435a9e40a86fa84e438a492350e839e0e1cbcd09c3b420b8dc83aa98bcd2db22
context/update/1/initial_change.py,"Processes input prompts and code through a two-step LLM chain to generate modified prompts based on requested changes, with cost tracking.","[""change""]","[""os"", ""typing"", ""rich"", ""langchain_core""]",43fa387f9f1cb1f4a6d4b214e4da990fdbb39b71b0a8e6df52cbd9a6ce6a0f56
context/update/1/modified_change.py,"Processes input prompts and code through a two-step LLM chain to generate modified prompts based on a change description, tracking token costs.","[""change""]","[""os"", ""typing"", ""rich"", ""langchain_core""]",fec3fba35a4710e02375bdb017bcf33882c2a3b690733fc9d5c6021c1602785c
context/update/2/initial_continue_generation.py,"Implements an iterative LLM continuation loop that extends incomplete code generations, trims results, and tracks token costs.","[""continue_generation"", ""TrimResultsOutput"", ""TrimResultsContinuedOutput""]","[""os"", ""typing"", ""rich"", ""langchain_core""]",e9cd8ad342ad7d0699595cab2854584162848e8c37719b0d3221a57b5fa03186
context/update/2/modified_continue_generation.py,"Implements an iterative LLM continuation loop that extends incomplete code generations, trims overlapping output, and tracks token costs.","[""continue_generation"", ""TrimResultsOutput"", ""TrimResultsContinuedOutput""]","[""os"", ""typing"", ""rich"", ""langchain_core""]",c5c930022897786dc668e13d807b29f7eef887ae731cdccee2a4415a1827260d
context/vertex_ai_litellm.py,Script that demonstrates calling Google Vertex AI's Gemini model via the litellm library using credentials loaded from a JSON file.,[],"[""litellm"", ""json"", ""os""]",ffbbe9dcdec01683ffe96cb1f027dbf1eb095f4f93158ffc2a47a443f2bbe699
.env.example,Configuration file for API keys of various LLM providers and project paths.,[],[],737cd7ac80451973147fdcbd24a8d3e150f0b493ba55ff22a1d519b098dd0d55
.github/workflows/notify-private.yml,Defines a GitHub Actions workflow that triggers a sync event to a private repository on pushes to the main branch.,[],[],bd3b201e292cd57e9adc978415888226187a59a37a70851041ecb91a87be262e
.github/workflows/pdd-secrets-dispatch.yml,GitHub Actions workflow to encrypt and send repository secrets to a callback URL upon dispatch.,[],"[""os"", ""json"", ""base64"", ""secrets"", ""requests"", ""cryptography""]",426daed826ee00bb364fa9dc04fc59aca2dcc169b9a02558071651cb583065b5
.github/workflows/unit-tests.yml,Defines a GitHub Actions workflow to run unit tests on pushes and pull requests to the main branch.,[],[],452a99d69da271bbd7a7950af6011fe68bb3751001481726d6c315e5da7f67c6
.gitignore,"This file specifies patterns for Git to ignore various temporary files, caches, builds, and directories in a development project.",[],[],4fe6c5371c8411b0d76439cded6e7c0621c581154520a5d84c7c9d68e5c8a306
.pddrc,Configures contexts and default settings for various components of the PDD CLI codebase.,[],[],3d43d7f7bf7666810230eefe09b53fc0bbb236882dddc56a8ae48985ce93aa77
CHANGELOG.md,"Changelog documenting updates, features, fixes, and refactors for the Prompt-Driven Development (PDD) project across versions v0.0.179 to v0.0.23.",[],[],95de96a1931dfc0b880333b55e0f1efe5a5bbdb9ece05edf2499f96f51f235db
CONTRIBUTING.md,"This file outlines guidelines for contributing to the PDD CLI project, covering setup, workflow, philosophy, and best practices.",[],[],1cf52ca8e1809a744674b676eeef94eebfc7bd9d940b1ddeb861943eb7bf9566
LICENSE,"Grants permission to use, modify, and distribute the software under the MIT license with copyright notice.",[],[],92f4c99e7c4f55362518a498e1937593376627497145d356c60ba9681dbbcec5
Makefile,"Makefile for the PDD project, providing targets for code generation, testing, building, publishing, and maintenance tasks.","[""help"", ""generate"", ""example"", ""run-examples"", ""test"", ""coverage"", ""regression"", ""sync-regression"", ""all-regression"", ""cloud-regression"", ""verify"", ""lint"", ""update"", ""fix"", ""crash""]",[],215a92c25a03ba5a6f60fb447fd14d7251e03aeb0d590e57552a472502f86cc1
